Ürün Adı,Kumaş Tipi,Materyal,Kalıp,Kol Boyu,Persona,Kol Tipi,Desen,Yaka Tipi,Renk,Ürün Detayı,Cep,Koleksiyon,Astar Durumu,Boy,Siluet,Ortam,Dokuma Tipi,Baskı/Nakış Tekniği,Kemer/Kuşak Durumu,Sürdürülebilirlik Detayı,Paket İçeriği,Yaş,Sezon,Menşei,Üretici Bilgisi,Ek Özellik,Kapama Şekli,Kalınlık,Kap
TRENDYOLMİLLA Vizon Maxi  Triko Yumuşak Dokulu Bağlama Detaylı Elbise TWOAW25EL00031,Triko,Triko,Regular,Uzun,Cool & Comfort,Standart Kol,Düz,Bisiklet Yaka,Bej,,Cepsiz,,Astarsız,Maxi,Shift,Casual/Günlük,Tek Plaka,,Kemersiz,Hayır,,Tüm Yaş Grupları,,TR,DSM Grup Danışmanlık İletişim ve Satış Ticaret A.Ş.,,,Orta,
TRENDYOLMİLLA Açık Mavi Çiçekli A Kesim Fırfırlı Midi Dokuma Elbise TWOSS20EL0894,Dokuma,Polyester,Regular,Kısa,Feminine,Balon Kol,Çiçekli,Dik Yaka,Mavi,Fırfırlı,,,Astarlı,Midi,A-line,Gündüz / Gece,Moss Krep,,Kemersiz,Hayır,,Tüm Yaş Grupları,Yaz,TR,DSM Grup Danışmanlık İletişim ve Satış Ticaret A.Ş.,A Kesim,,,
TRENDYOLMİLLA Lacivert Vücuda Oturan Desenli Dokulu Payet Dokuma Kısa Şık Elbise TPRSS25EL00186,Dokuma,,Fitted,Kolsuz,Fashion Forward,Standart Kol,Düz,V Yaka,Lacivert,,,,Astarlı,Mini,Bodycone,Şık/Gece,Payet,,,,,,,TR,DSM Grup Danışmanlık İletişim ve Satış Ticaret A.Ş.,Vücudu Saran,,,
TRENDYOLMİLLA Siyah Vücuda Oturan Taş Baskı Örme Kısa Şık Elbise TPRSS25EL00273,Örme,,Fitted,Askılı,Fashion Forward,Standart Kol,Düz,Degaje Yaka,Siyah,Taş Baskı,,,Astarsız,Mini,Bodycone,Kokteyl,Sandy,,,,,,,TR,DSM Grup Danışmanlık İletişim ve Satış Ticaret A.Ş.,,,,
Trendyol Curve Siyah Carmen Yaka Tül Örme Büyük Beden Elbise TBBSS25AH00115,Örme,,Slim,Kolsuz,Fashion Forward,Standart Kol,Düz,Carmen Yaka,Siyah,,,,,Mini,Bodycone,Casual/Günlük,Tül,,,,,,,TR,DSM Grup Danışmanlık İletişim ve Satış Ticaret A.Ş.,,,,
Trendyol Curve Siyah Kısa Kol Mini Dokuma Büyük Beden Elbise TBBSS25AH00065,Dokuma,,Relaxed,Kısa,Fashion Forward,Standart Kol,Düz,Bisiklet Yaka,Siyah,,,,,Mini,A-line,Business,Finike,,,,,Tüm Yaş Grupları,,TR,DSM Grup Danışmanlık İletişim ve Satış Ticaret A.Ş.,,,,
TRENDYOLMİLLA Ekru Çiçek Baskılı Parlak Yüzeyli Kayık Kaya Vücuda Oturan Esnek Örme Kalem Elbise TWOSS24EL00528,Örme,Polyester Karışımlı,Slim,Kolsuz,Cool & Comfort,Standart Kol,Çiçekli,Kayık Yaka,Ekru,Büzgülü,,Ramadan,Astarlı,Maxi,Bodycone,Gündüz / Gece,Venezia,,Kemersiz,Hayır,,Tüm Yaş Grupları,Yaz,TR,DSM Grup Danışmanlık İletişim ve Satış Ticaret A.Ş.,,,,
TRENDYOLMİLLA Taş Maxi Triko Saç Örgülü Geniş Kalıp Elbise TWOAW25EL00078,Triko,,Oversize,Uzun,Cool & Comfort,Standart Kol,Saç Örgü,Bisiklet Yaka,Bej,,,Ramadan,Astarsız,Maxi,Shift,Casual/Günlük,Tek Plaka,,,,,,,TR,DSM Grup Danışmanlık İletişim ve Satış Ticaret A.Ş.,,,Orta,
TRENDYOLMİLLA Kırmızı A-Kesim Gül Detaylı Dokuma Kısa Şık Elbise TPRSS25EL00263,Dokuma,,Fitted,Askılı,Fashion Forward,Standart Kol,Düz,V Yaka,Kırmızı,Gül Detaylı,,,Astarsız,Mini,A-line,Kokteyl,Finike,,,,,,,TR,DSM Grup Danışmanlık İletişim ve Satış Ticaret A.Ş.,,,,
TRENDYOLMİLLA Kiremit Çiçek Desenli A Kesim Volanlı Astarlı Midi Dokuma Elbise TWOSS20EL0894,Dokuma,Polyester,Regular,Kısa,Feminine,Balon Kol,Çiçekli,Dik Yaka,Turuncu,Fırfırlı,,,Astarlı,Midi,A-line,Gündüz / Gece,Moss Krep,,Kemersiz,Hayır,,Tüm Yaş Grupları,Yaz,TR,DSM Grup Danışmanlık İletişim ve Satış Ticaret A.Ş.,A Kesim,,,
TRENDYOLMİLLA Siyah Vücuda Oturan Yırtmaçlı Bisiklet Yaka Midi Fitilli Esnek Örme Kalem Elbise TWOAW21EL0135,Dokuma,Polyester Karışımlı,Slim,Uzun,Cool & Comfort,Standart Kol,Düz,Dik Yaka,Siyah,Yırtmaçlı,Cepsiz,Ramadan,Astarsız,Midi,Bodycone,Casual/Günlük,Rejenere Kaşkorse,Baskısız,Kemersiz,Hayır,Tekli,Tüm Yaş Grupları,Kış,TR,DSM Grup Danışmanlık İletişim ve Satış Ticaret A.Ş.,,,,
TRENDYOLMİLLA Açık Pembe %100 Pamuk Bele Oturan Yırtmaç ve Bağlama Detaylı Midi Örme Kalem Elbise TWOSS21EL0404,Örme,%100 Pamuk,Slim,Kısa,Cool & Comfort,Düşük Kol,Düz,Bisiklet Yaka,Pembe,Bağlama Detaylı,,Ramadan,Astarsız,Midi,Bodycone,Casual/Günlük,20/1 penye süprem,,Kemersiz,Hayır,,Tüm Yaş Grupları,Yaz,TR,DSM Grup Danışmanlık İletişim ve Satış Ticaret A.Ş.,,,,
Trendyol Curve Çok Renkli A-line Çiçek Desenli V Yaka Örme Büyük Beden Elbise TBBSS22AH00010,Örme,Polyester Karışımlı,Relaxed,Kolsuz,Cool & Comfort,Standart Kol,Çiçekli,Kruvaze,Çok Renkli,,Cepsiz,Ramadan,,Maxi,A-line,Casual/Günlük,Kaşkorse,,Kemersiz,Hayır,,Tüm Yaş Grupları,Yaz,TR,DSM Grup Danışmanlık İletişim ve Satış Ticaret A.Ş.,,,,
TRENDYOLMİLLA Siyah Vücuda Oturan Degaje Yaka Midi Askılı Esnek Örme Midi Kalem Elbise TWOSS19AD0020,Örme,Elastan,Slim,Askılı,Smart,Standart Kol,Düz,Degaje Yaka,Siyah,,Cepsiz,Ramadan,Astarsız,Midi,Bodycone,Gündüz / Gece,Sandy,Baskısız,Kemersiz,Hayır,Tekli,Tüm Yaş Grupları,Yaz,TR,DSM Grup Danışmanlık İletişim ve Satış Ticaret A.Ş.,,,,
Trendyol Curve Siyah V Yaka Balon Kol Kuşaklı Ponponlu Dokuma Mini Büyük Beden Elbise TBBAW25AH00053,Dokuma,Polyester,Fitted,Uzun,Feminine,Standart Kol,Dokulu,V Yaka,Siyah,,Cepsiz,,Astarsız,Midi,A-line,Kokteyl,Finike,,Kuşaklı,Hayır,,Tüm Yaş Grupları,İlkbahar / Sonbahar,TR,DSM Grup Danışmanlık İletişim ve Satış Ticaret A.Ş.,,,,
Trendyol Curve Kahverengi A-line Dokuma Elbise TBBSS24AH00052,Dokuma,Pamuklu,Fitted,Truvakar Kol,Cool & Comfort,Balon Kol,Düz,V Yaka,Kahverengi,,Cepsiz,,Astarsız,Midi,A-line,Casual/Günlük,Keten karışımlı,,Kemersiz,Hayır,,Tüm Yaş Grupları,,TR,DSM Grup Danışmanlık İletişim ve Satış Ticaret A.Ş.,,,,
TRENDYOLMİLLA Siyah Vücuda Oturan Astarlı Parlak Taşlı Dokuma Şık Abiye Elbise TPRSS23EL00476,Dokuma,Polyester Karışımlı,Fitted,Kolsuz,Fashion Forward,Standart Kol,Düz,Straplez,Siyah,Taş Aksesuar,Cepsiz,,Astarsız,Midi,Bodycone,Şık/Gece,Finike,Baskısız,Kemersiz,Hayır,Tekli,Tüm Yaş Grupları,Yaz,TR,DSM Grup Danışmanlık İletişim ve Satış Ticaret A.Ş.,,,,
TRENDYOLMİLLA Siyah A-Kesim Straplez Dokuma Şık Abiye Elbise TPRSS24EL00139,Dokuma,Polyester,Fitted,Kolsuz,Fashion Forward,Standart Kol,Düz,Straplez,Siyah,Taş Baskı,,Ramadan,Astarsız,Midi,Skater,Şık/Gece,Finike,,Kemersiz,Hayır,,Tüm Yaş Grupları,Yaz,TR,DSM Grup Danışmanlık İletişim ve Satış Ticaret A.Ş.,Eteği Belden Açılan,,,
TRENDYOLMİLLA Kırmızı Düz Piliseli Mini Dokuma Elbise TWOSS25EL00753,Dokuma,,Regular,Askılı,Feminine,Standart Kol,Düz,Havuz Yaka,Kırmızı,Piliseli,,,Astarsız,Mini,Skater,Gündüz / Gece,Finike,,,,,,,TR,DSM Grup Danışmanlık İletişim ve Satış Ticaret A.Ş.,,,,
TRENDYOLMİLLA Limited Edition Yeşil Kruvaze Bağlama Detaylı V Yaka Esnek Midi Örme Elbise TWOSS25EL00479,Örme,Polyester Karışımlı,Slim,Kolsuz,Fashion Forward,Standart Kol,Düz,Kruvaze,Yeşil,,,,Astarsız,Midi,Bodycone,Şık/Gece,Kalın Sandy,,,,,,,TR,DSM Grup Danışmanlık İletişim ve Satış Ticaret A.Ş.,,,,
Trendyol Curve Beyaz Yazlık Gipeli Ayarlanabilir Askılı Brode Midi Dokuma Büyük Beden Elbise TBBSS25AH00165,Dokuma,,Relaxed,Askılı,Feminine,Standart Kol,Düz,Kare Yaka,Beyaz,,,,,Maxi,A-line,Casual/Günlük,Brode,,,,,,Yaz,TR,DSM Grup Danışmanlık İletişim ve Satış Ticaret A.Ş.,,,,
TRENDYOLMİLLA Kahverengi Kuşaklı Dantel Detaylı Mini Dokuma Gömlek Elbise TWOAW21EL1964,Dokuma,Pamuklu,Regular,Uzun,Cool & Comfort,Standart Kol,Düz,Gömlek Yaka,Kahverengi,Dantel Detaylı,Cepsiz,,Astarsız,Mini,Gömlek Elbise,Casual/Günlük,Flanel,,Kuşaklı,Hayır,,Tüm Yaş Grupları,Kış,TR,DSM Grup Danışmanlık İletişim ve Satış Ticaret A.Ş.,,Kuşaklı,,
TRENDYOLMİLLA Siyah Kruvaze Yaka A-Line Krep Mini Smart Örme Elbise TWOSS23EL01703,Örme,Polyester,Regular,Kısa,Smart,Standart Kol,Düz,V Yaka,Siyah,,,,Astarsız,Mini,Anvelop,Casual/Günlük,Scuba Krep,,Kemersiz,Hayır,,Tüm Yaş Grupları,,TR,DSM Grup Danışmanlık İletişim ve Satış Ticaret A.Ş.,,,,
TRENDYOLMİLLA Bordo Düz Eteği Belden Açılan Bağlama Detaylı Mini Dokuma Elbise TWOSS25EL00747,Dokuma,,Regular,Kolsuz,Smart,Standart Kol,Düz,Bisiklet Yaka,Bordo,,,,Astarsız,Mini,Skater,Casual/Günlük,Finike,,,,,,,TR,DSM Grup Danışmanlık İletişim ve Satış Ticaret A.Ş.,,,,
TRENDYOLMİLLA Siyah Kuşaklı A-Kesim Astarlı Piliseli Örme Kısa Şık Abiye Elbise TPRAW24EL00108,Örme,Polyester,Relaxed,Uzun,Smart,Standart Kol,Düz,Kruvaze,Siyah,Bağlama Detaylı,Cepsiz,Ramadan,Astarlı,Mini,Skater,Şık/Gece,Pilise,Baskısız,Kuşaklı,Hayır,Tekli,Tüm Yaş Grupları,Kış,TR,DSM Grup Danışmanlık İletişim ve Satış Ticaret A.Ş.,Eteği Belden Açılan,Kuşaklı,,
Trendyol Curve Siyah Kare Yaka Krep Örme Büyük Beden Elbise TBBAW25AH00042,Örme,Polyester,Fitted,Uzun,Cool & Comfort,Standart Kol,Düz,Kare Yaka,Siyah,,Cepsiz,,Astarsız,Midi,Shift,Casual/Günlük,Krep,,Kemersiz,Hayır,,Tüm Yaş Grupları,İlkbahar / Sonbahar,TR,DSM Grup Danışmanlık İletişim ve Satış Ticaret A.Ş.,,,,
Trendyol Curve Koyu Mor 2 İplik Şardonsuz Bisiklet Yaka Örme Büyük Beden Sweatshirt Elbise TBBAW25AH00101,Örme,Pamuklu,Relaxed,Uzun,Cool & Comfort,Standart Kol,Düz,Bisiklet Yaka,Mor,,Cepsiz,Ramadan,Astarsız,Mini,T-shirt Elbise,Casual/Günlük,2 İplik Şardonsuz,,Kemersiz,Hayır,Tekli,Tüm Yaş Grupları,Kış,TR,DSM Grup Danışmanlık İletişim ve Satış Ticaret A.Ş.,,,,
TRENDYOLMİLLA Limited Edition Koyu Mavi Cut-Out Pencere Detaylı Gömlek Yaka Mini Denim Elbise TWOSS25EL00505,Denim,,Relaxed,Kolsuz,Fashion Forward,Standart Kol,Düz,Gömlek Yaka,Mavi,Düğmeli,,,Astarsız,Kısa,Basic,Casual/Günlük,Rigid,,,,,,Yaz,TR,DSM Grup Danışmanlık İletişim ve Satış Ticaret A.Ş.,,,,
TRENDYOLMİLLA Kırmızı Pötikareli A Kesim Yakası Dantel Detaylı Midi Dokuma Elbise TWOSS25EL00297,Dokuma,,Regular,Kısa,Cool & Comfort,Balon Kol,Ekose / Kareli,Kalp Yaka,Kırmızı,Dantel Detaylı,,,Astarsız,Midi,A-line,Casual/Günlük,Gofre,,,,,Tüm Yaş Grupları,Yaz,TR,DSM Grup Danışmanlık İletişim ve Satış Ticaret A.Ş.,A Kesim,,,
TRENDYOLMİLLA Yağ Yeşil Kuşaklı Düz Düğme Detaylı Mini Dokuma Gömlek Elbise TWOSS25EL00436,Dokuma,,Regular,Truvakar Kol,Cool & Comfort,Reglan Kol,Düz,Gömlek Yaka,Yeşil,,,Giy-Çık,Astarsız,Mini,Gömlek Elbise,Casual/Günlük,Aerobin,,Kuşaklı,,,,,TR,DSM Grup Danışmanlık İletişim ve Satış Ticaret A.Ş.,,,,
TRENDYOLMİLLA Siyah Maxi Dokuma Sırt Dekolteli Keten Karışımlı Plaj Elbisesi TBESS24EL00096,Dokuma,,Fitted,Kolsuz,Feminine,Standart Kol,Düz,Degaje Yaka,Siyah,,,,Astarsız,Maxi,Shift,Beachwear,Keten karışımlı,,,,,,Yaz,TR,DSM Grup Danışmanlık İletişim ve Satış Ticaret A.Ş.,,,,
Trendyol Curve Kahverengi Tek Omuz Midi Örme Elbise TBBSS24AH00083,Örme,Polyester,Fitted,Kısa,Smart,Tek Kol,Düz,Asimetrik Yaka,Kahverengi,,Cepsiz,,Astarsız,Midi,Bodycone,Party,Krep,,Kemersiz,Hayır,,Tüm Yaş Grupları,İlkbahar / Sonbahar,TR,DSM Grup Danışmanlık İletişim ve Satış Ticaret A.Ş.,,,,
TRENDYOLMİLLA Siyah Düz Bodycone Mini Triko Elbise TWOSS24EL00854,Triko,Triko,Regular,Kolsuz,Cool & Comfort,Standart Kol,Düz,Boyundan Bağlamalı,Siyah,,Cepsiz,,Astarsız,Mini,Bodycone,Casual/Günlük,Tek Plaka,,Kemersiz,Hayır,,Tüm Yaş Grupları,,TR,DSM Grup Danışmanlık İletişim ve Satış Ticaret A.Ş.,,,İnce,
TRENDYOLMİLLA Ekru Kuşaklı A Kesim Tüvit Midi Dokuma Elbise TWOAW25EL00238,Dokuma,Viskoz Karışımlı,Regular,Kısa,Smart,Standart Kol,Düz,Bisiklet Yaka,Ekru,,Cepsiz,,Astarsız,Midi,A-line,Business,Tüvit,Baskısız,Kuşaklı,Hayır,Tekli,Tüm Yaş Grupları,İlkbahar / Sonbahar,TR,DSM Grup Danışmanlık İletişim ve Satış Ticaret A.Ş.,,Kuşaklı,,
Trendyol Curve Siyah Dik Yaka Şifon Çıtır Çiçek Desenli Dokuma Büyük Beden Elbise TBBAW25AH00119,Dokuma,,Fitted,Uzun,Cool & Comfort,Balon Kol,Çiçekli,Dik Yaka,Siyah,,,,,Mini,A-line,Casual/Günlük,Şifon,,,,,,,TR,DSM Grup Danışmanlık İletişim ve Satış Ticaret A.Ş.,,,,
TRENDYOLMİLLA Siyah Düz Maxi Aksesuar Detaylı Esnek  Örme Elbise TWOSS25EL00592,Örme,,Slim,Kolsuz,Fashion Forward,Standart Kol,Düz,Bisiklet Yaka,Siyah,,,Ramadan,Astarsız,Midi,Bodycone,Casual/Günlük,Kalın Sandy,,,,,,,TR,DSM Grup Danışmanlık İletişim ve Satış Ticaret A.Ş.,,,,
TRENDYOLMİLLA Lacivert Soyut Mini  Dokuma Elbise TWOSS23EL01171,Dokuma,Polyester,Regular,Kısa,Feminine,Balon Kol,Soyut,Kare Yaka,Lacivert,,,,Astarlı,Mini,Skater,Gündüz / Gece,Şifon,,Kemersiz,Hayır,,Tüm Yaş Grupları,Yaz,TR,DSM Grup Danışmanlık İletişim ve Satış Ticaret A.Ş.,Eteği Belden Açılan,,,
TRENDYOLMİLLA Zümrüt Yeşili Düz Mini  Dokuma Elbise TWOAW25EL00588,Dokuma,%100 Pamuk,Regular,Uzun,Cool & Comfort,Standart Kol,Renk Bloklu,Gömlek Yaka,Yeşil,,,,Astarsız,Mini,Bodycone,Casual/Günlük,Gabardin,,Kemersiz,Hayır,,Tüm Yaş Grupları,Kış,TR,DSM Grup Danışmanlık İletişim ve Satış Ticaret A.Ş.,Vücudu Saran,,,
TRENDYOLMİLLA Siyah Kayık Yaka Sırt Dekolteli Yırtmaçlı Fitted/Vücuda Oturan Maxi Esnek Örme Elbise TWOAW24EL00824,Örme,Polyester Karışımlı,Slim,Uzun,Smart,Standart Kol,Düz,Kayık Yaka,Siyah,Sırt Dekolteli,Cepsiz,,Astarsız,Maxi,Bodycone,Gündüz / Gece,Kalın Sandy,,Kemersiz,Hayır,Tekli,Tüm Yaş Grupları,Kış,TR,DSM Grup Danışmanlık İletişim ve Satış Ticaret A.Ş.,Yırtmaçlı,,,
Trendyol Curve Vizon A-line Dokuma Elbise TBBSS24AH00052,Dokuma,Pamuklu,Fitted,Truvakar Kol,Cool & Comfort,Balon Kol,Düz,V Yaka,Bej,,Cepsiz,,Astarsız,Midi,A-line,Casual/Günlük,Keten karışımlı,,Kemersiz,Hayır,,Tüm Yaş Grupları,,TR,DSM Grup Danışmanlık İletişim ve Satış Ticaret A.Ş.,,,,
TRENDYOLMİLLA Koyu Kahverengi Düz Lastikli Midi  Dokuma Elbise TWOSS22EL1768,Dokuma,Pamuklu,Regular,Kısa,Cool & Comfort,Standart Kol,Düz,Kare Yaka,Kahverengi,Lastikli,,,Astarlı,Midi,Skater,Casual/Günlük,Terrycotton,,Kemersiz,Hayır,,Tüm Yaş Grupları,Yaz,TR,DSM Grup Danışmanlık İletişim ve Satış Ticaret A.Ş.,Eteği Belden Açılan,,,
Trendyol Curve Siyah Polo Yaka Fitilli Triko Elbise TBBAW23AH00002,Triko,Akrilik,Fitted,Uzun,Cool & Comfort,Standart Kol,Düz,Polo Yaka,Siyah,,Cepsiz,Ramadan,Astarsız,Midi,Bodycone,Casual/Günlük,Fitilli,,Kemersiz,Hayır,Tekli,Tüm Yaş Grupları,Kış,TR,DSM Grup Danışmanlık İletişim ve Satış Ticaret A.Ş.,,,,
TRENDYOLMİLLA Siyah A-Kesim Poplin Dokuma Şık Elbise TPRSS25EL00158,Dokuma,,Fitted,Askılı,Feminine,Standart Kol,Düz,Kare Yaka,Siyah,,,Ramadan,Astarlı,Midi,Skater,Şık/Gece,Poplin,,,,,,,TR,DSM Grup Danışmanlık İletişim ve Satış Ticaret A.Ş.,,,,
TRENDYOLMİLLA Fuşya Düz Büzgülü Maxi  Sıfır Kol Drapeli Bodycone/Vücuda Oturan Esnek Örme Elbise TWOSS24EL00101,Örme,Polyester,Slim,Kolsuz,Fashion Forward,Standart Kol,Düz,Dik Yaka,Pembe,Büzgü / Drape,,Ramadan,Astarsız,Maxi,Bodycone,Casual/Günlük,Kalın Sandy,,Kemersiz,Hayır,,Tüm Yaş Grupları,Yaz,TR,DSM Grup Danışmanlık İletişim ve Satış Ticaret A.Ş.,,,,
TRENDYOLMİLLA Lacivert Kemerli A Kesim Piliseli Maxi Astarlı Şifon Dokuma Elbise TWOAW24EL00471,Dokuma,Polyester,Regular,Uzun,Feminine,Balon Kol,Çiçekli,Kruvaze,Lacivert,Kemerli,Cepsiz,Ramadan,Astarlı,Midi,A-line,Gündüz / Gece,Şifon,Baskısız,Kemerli,Hayır,Tekli,Tüm Yaş Grupları,Kış,TR,DSM Grup Danışmanlık İletişim ve Satış Ticaret A.Ş.,A Kesim,Kemer Tokası,,
Edit by Trendyol Fuşya Çiçekli Midi Dokuma Elbise TEDSS25EL00002,Dokuma,,Regular,Kısa,Cool & Comfort,Standart Kol,Çiçekli,Kruvaze,Pembe,,,,Astarsız,Midi,Skater,Casual/Günlük,Shally,,,,,,,TR,DSM Grup Danışmanlık İletişim ve Satış Ticaret A.Ş.,,,,
TRENDYOLMİLLA Beyaz Düz Bodycone Krep Mini Dokuma Elbise TWOSS24EL00874,Dokuma,Polyester,Regular,Kısa,Feminine,Balon Kol,Düz,Carmen Yaka,Beyaz,,Cepsiz,,Astarlı,Mini,A-line,Gündüz / Gece,Krep,,Kemersiz,Hayır,,Tüm Yaş Grupları,Yaz,TR,DSM Grup Danışmanlık İletişim ve Satış Ticaret A.Ş.,A Kesim,,,
TRENDYOLMİLLA Siyah Kemerli Vücuda Oturan Mini Dokuma Elbise TWOAW25EL00365,Dokuma,Polyester Karışımlı,Fitted,Uzun,Fashion Forward,Standart Kol,Düz,Kayık Yaka,Siyah,,,,Astarsız,Mini,A-line,Gündüz / Gece,Finike,,Kemerli,Hayır,,Tüm Yaş Grupları,Kış,TR,DSM Grup Danışmanlık İletişim ve Satış Ticaret A.Ş.,A Kesim,,,
TRENDYOLMİLLA Siyah Mini Örme Dantel Plaj Elbisesi TBESS25EL00088,Örme,,Fitted,Uzun,Fashion Forward,Standart Kol,Düz,Bisiklet Yaka,Siyah,Dantel,,,Astarsız,Mini,A-line,Beachwear,Shally,,,,,,,TR,DSM Grup Danışmanlık İletişim ve Satış Ticaret A.Ş.,,,,
Trendyol Curve Yeşil Şifon Animal Desemli Beli Kuşaklı Dokuma Büyük Beden Gömlek Elbise TBBAW25AH00115,Dokuma,Polyester,Relaxed,Uzun,Cool & Comfort,Balon Kol,Animal,Gömlek Yaka,Yeşil,,,,,Midi,Shift,Casual/Günlük,Şifon,,,Hayır,,Tüm Yaş Grupları,,TR,DSM Grup Danışmanlık İletişim ve Satış Ticaret A.Ş.,,,,
TRENDYOLMİLLA Beyaz Vücuda Oturan Taş Baskı Detaylı Dokuma Midi Şık Elbise TPRSS25EL00243,Dokuma,,Fitted,Kısa,Fashion Forward,Standart Kol,Düz,Carmen Yaka,Beyaz,Taş Baskı,,Ramadan,Astarsız,Midi,Bodycone,Şık/Gece,Finike,,,,,,Yaz,TR,DSM Grup Danışmanlık İletişim ve Satış Ticaret A.Ş.,Düz Kesim,,,
TRENDYOLMİLLA Siyah Tüvit Dokuma Kısa Elbise TPRAW25EL00076,Dokuma,Polyester Karışımlı,Fitted,Kolsuz,Smart,Standart Kol,Düz,Kare Yaka,Siyah,Taş Aksesuar,Cepsiz,,Astarsız,Mini,Skater,Şık/Gece,Tüvit,Baskısız,Kemersiz,Hayır,Tekli,Tüm Yaş Grupları,Kış,TR,DSM Grup Danışmanlık İletişim ve Satış Ticaret A.Ş.,Düz Kesim,,,
TRENDYOLMİLLA Siyah Vücuda Oturan Astarlı Parıltılı Pullu Örme Payet Şık Abiye Elbise TPRAW24EL00233,Örme,Polyester Karışımlı,Regular,Kolsuz,Fashion Forward,Standart Kol,Düz,Halter Yaka,Siyah,,Cepsiz,Ramadan,Astarlı,Midi,Bodycone,Kokteyl,Payet,Pul işleme,Kemersiz,Hayır,Tekli,Tüm Yaş Grupları,Kış,TR,DSM Grup Danışmanlık İletişim ve Satış Ticaret A.Ş.,,,,
TRENDYOLMİLLA Açık Kahverengi Düz Düğme Detaylı A Line/A Kesim Süet Jile Midi Örme Elbise TWOAW25EL00321,Örme,Polyester,Slim,Kısa,Fashion Forward,Standart Kol,Düz,Havuz Yaka,Kahverengi,Düğmeli,,,Astarsız,Midi,Jile,Casual/Günlük,Süet,,Kemersiz,Hayır,,Tüm Yaş Grupları,Kış,TR,DSM Grup Danışmanlık İletişim ve Satış Ticaret A.Ş.,,,,
TRENDYOLMİLLA Çok Renkli Düz Fırfırlı Dokuma Yoryo Şifon Mini Astarlı Şık/Gece Elbise,Dokuma,,Fitted,Uzun,Feminine,Standart Kol,Düz,V Yaka,Çok Renkli,Fırfırlı,,Ramadan,Astarlı,Mini,Skater,Şık/Gece,Yoryo Şifon,,,,,,,TR,DSM Grup Danışmanlık İletişim ve Satış Ticaret A.Ş.,,,,
Trendyol Curve Pembe Askılı Vücuda Oturan Örme Tül Büyük Beden Elbise TBBSS25AH00016,Örme,,Fitted,Askılı,Cool & Comfort,Standart Kol,Baskılı,Kare Yaka,Pembe,,,,,Midi,Bodycone,Casual/Günlük,Tül,,,,,,Yaz,TR,DSM Grup Danışmanlık İletişim ve Satış Ticaret A.Ş.,,,,
TRENDYOLMİLLA Lacivert Düğme Detaylı Gabardin Mini Dokuma Gömlek Elbise TWOSS22EL2970,Dokuma,Dokuma,Regular,Kısa,Smart,Ay Kol,Düz,Ceket Yaka,Lacivert,,Cepsiz,,Astarsız,Mini,Ceket Elbise,Gündüz / Gece,Gabardin,Baskısız,Kemersiz,Hayır,Tekli,Tüm Yaş Grupları,Yaz,TR,DSM Grup Danışmanlık İletişim ve Satış Ticaret A.Ş.,,Düğmeli,,
Trendyol Curve Siyah Kayık Yaka A-line Kaşkorse Örme Büyük Beden Elbise TBBSS25AH00196,Örme,,Slim,Kolsuz,Cool & Comfort,Standart Kol,Düz,U Yaka,Siyah,,,,,Mini,A-line,Casual/Günlük,Kaşkorse,,,,,,,TR,DSM Grup Danışmanlık İletişim ve Satış Ticaret A.Ş.,,,,
TRENDYOLMİLLA Siyah Çiçekli Eteği Belden Açılan Agraflı Mini Dokuma Elbise TWOSS25EL00419,Dokuma,,Regular,Askılı,Cool & Comfort,Standart Kol,Çiçekli,Kare Yaka,Siyah,Agraflı,,,Astarsız,Mini,Skater,Casual/Günlük,Shally,,,,,,,TR,DSM Grup Danışmanlık İletişim ve Satış Ticaret A.Ş.,Eteği Belden Açılan,,,
TRENDYOLMİLLA Siyah Midi Triko Polo Yaka Elbise TWOSS24EL00831,Triko,Polyester,Slim,Kısa,Cool & Comfort,Standart Kol,Renk Bloklu,Polo Yaka,Siyah,,,,Astarsız,Midi,Basic,Casual/Günlük,Tek Plaka,,Kemersiz,Hayır,,Tüm Yaş Grupları,,TR,DSM Grup Danışmanlık İletişim ve Satış Ticaret A.Ş.,,,İnce,
Trendyol Curve Siyah Sandy Örme Büyük Beden Elbise,Örme,,Slim,Kısa,Cool & Comfort,Standart Kol,Düz,Kruvaze,Siyah,,,,,Mini,Skater,Casual/Günlük,Sandy,,,,,,Yaz,TR,DSM Grup Danışmanlık İletişim ve Satış Ticaret A.Ş.,,,,
TRENDYOLMİLLA Yağ Yeşili Kruvaze Yaka A-Line Krep Mini Smart Örme Elbise TWOSS23EL01703,Örme,Polyester,Regular,Kısa,Smart,Standart Kol,Düz,V Yaka,Yeşil,,,,Astarsız,Mini,Anvelop,Casual/Günlük,Scuba Krep,,Kemersiz,Hayır,,Tüm Yaş Grupları,,TR,DSM Grup Danışmanlık İletişim ve Satış Ticaret A.Ş.,,,,
TRENDYOLMİLLA Siyah A-Kesim Astarlı Volanlı Dokuma Şifon Kısa Şık Abiye Elbise TPRSS23EL00096,Dokuma,,Regular,Uzun,Feminine,Standart Kol,Düz,Carmen Yaka,Siyah,Volanlı / Fırfırlı,,,Astarlı,Mini,Skater,Şık/Gece,Şifon,,,,,,Yaz,TR,DSM Grup Danışmanlık İletişim ve Satış Ticaret A.Ş.,Eteği Belden Açılan,,,
TRENDYOLMİLLA Kırmızı Vücuda Oturan Dokuma Elbise TPRSS24EL00136,Dokuma,,Fitted,Askılı,Smart,Standart Kol,Çiçekli,Kare Yaka,Kırmızı,,,,Astarsız,Midi,Bodycone,Şık/Gece,Finike,,,,,,Yaz,TR,DSM Grup Danışmanlık İletişim ve Satış Ticaret A.Ş.,Vücudu Saran,,,
TRENDYOLMİLLA Kahverengi Maxi Dokuma Askılı Plaj Elbisesi TBESS25EL00099,Dokuma,,Fitted,Askılı,Feminine,Standart Kol,Düz,V Yaka,Kahverengi,,,,Astarsız,Maxi,A-line,Beachwear,Crinkle,,,,,,,TR,DSM Grup Danışmanlık İletişim ve Satış Ticaret A.Ş.,,,,
TRENDYOLMİLLA Kırmızı Belden Açılan Midi Kruvaze Piliseli Ayarlanabilir Askılı Örme Elbise TWOSS20EL2729,Örme,Polyester,Regular,Askılı,Feminine,Standart Kol,Düz,Kruvaze,Kırmızı,Piliseli,,Ramadan,Astarlı,Midi,Skater,Casual/Günlük,Polyester Kaşkorse,,Kemersiz,Hayır,,Tüm Yaş Grupları,Yaz,TR,DSM Grup Danışmanlık İletişim ve Satış Ticaret A.Ş.,,,,
TRENDYOLMİLLA Kırmızı Piliseli Astarlı Şifon Dokuma Elbise TWOAW24EL00478,Dokuma,Dokuma,Regular,Uzun,Feminine,Balon Kol,Düz,Kruvaze,Kırmızı,Piliseli,Cepsiz,,Astarlı,Midi,A-line,Gündüz / Gece,Şifon,Baskısız,Kuşaklı,Hayır,Tekli,Tüm Yaş Grupları,Kış,TR,DSM Grup Danışmanlık İletişim ve Satış Ticaret A.Ş.,A Kesim,Kuşaklı,,
TRENDYOLMİLLA Pembe Kuşaklı  Çiçek Desenli A Kesim Kruvaze Yaka Midi Dokuma Elbise TWOSS24EL00915,Dokuma,,Regular,Truvakar Kol,Cool & Comfort,Düşük Kol,Çiçekli,Kruvaze,Pembe,Lastikli,Cepsiz,Ramadan,Astarsız,Midi,Skater,Casual/Günlük,Shally,,Kuşaklı,Hayır,,Tüm Yaş Grupları,Yaz,TR,DSM Grup Danışmanlık İletişim ve Satış Ticaret A.Ş.,Eteği Belden Açılan,,,
Trendyol Curve Antrasit Tüvit Toka Aksesuarlı Uzun Kol Dokuma Büyük Beden Elbise TBBAW25AH00092,Dokuma,Polyester,Relaxed,Uzun,Smart/Office,Standart Kol,Düz,Bisiklet Yaka,Gri,,Cepsiz,,Astarsız,Midi,A-line,Business,Tüvit,,Kemersiz,Hayır,Tekli,Tüm Yaş Grupları,Kış,TR,DSM Grup Danışmanlık İletişim ve Satış Ticaret A.Ş.,,,,
TRENDYOLMİLLA Mavi Etek Ucu Püsküllü Kemerli Maxi Denim Elbise TWOSS24EL00377,Denim,%100 Pamuk,Fitted,Kısa,Cool & Comfort,Standart Kol,Düz,Gömlek Yaka,Mavi,Kemerli,Cepsiz,,Astarsız,Maxi,Basic,Casual/Günlük,Rigid,,Kemerli,Hayır,,Tüm Yaş Grupları,İlkbahar / Sonbahar,TR,DSM Grup Danışmanlık İletişim ve Satış Ticaret A.Ş.,,,,
Trendyol Curve Kırmızı Dokuma Önü Düğmeli Elbise TBBSS22EL1673,Dokuma,Polyester,Fitted,Kısa,Cool & Comfort,Balon Kol,Düz,Kare Yaka,Kırmızı,,Cepsiz,Büyük Beden,Astarsız,Mini,A-line,Casual/Günlük,Shally,,Kemersiz,Hayır,,Tüm Yaş Grupları,,TR,DSM Grup Danışmanlık İletişim ve Satış Ticaret A.Ş.,,,,
TRENDYOLMİLLA Siyah Düğmeli Kolsuz Midi Dokuma Gömlek Elbise TWOSS24EL00442,Dokuma,Polyester,Regular,Kolsuz,Cool & Comfort,Standart Kol,Düz,V Yaka,Siyah,,Cepsiz,,Astarsız,Maxi,Gömlek Elbise,Casual/Günlük,Aerobin,,Kemersiz,Hayır,,Tüm Yaş Grupları,Yaz,TR,DSM Grup Danışmanlık İletişim ve Satış Ticaret A.Ş.,,,,
TRENDYOLMİLLA Kahverengi Mini Triko Dantelli Elbise TWOAW22EL0011,Triko,Akrilik,Regular,Uzun,Feminine,Standart Kol,Düz,Dik Yaka,Kahverengi,Dantel,Cepsiz,Basic,Astarsız,Mini,A-line,Business,Tek Plaka,Baskısız,Kemersiz,Hayır,Tekli,Tüm Yaş Grupları,,TR,DSM Grup Danışmanlık İletişim ve Satış Ticaret A.Ş.,,,Orta,
Trendyol Curve Siyah Çizgi Detaylı Triko Elbise TBBAW24AH00019,Triko,Akrilik,Fitted,Uzun,Smart,Standart Kol,Çizgili,Bisiklet Yaka,Siyah,,Cepsiz,Büyük Beden,Astarsız,Mini,Kazak Elbise,Casual/Günlük,Fitilli,,Kemersiz,Hayır,Tekli,Tüm Yaş Grupları,Kış,TR,DSM Grup Danışmanlık İletişim ve Satış Ticaret A.Ş.,Yırtmaçlı,,,
Trendyol Curve Siyah Kare Yaka Kısa Kol Brode Dokuma Büyük Beden Elbise TBBSS25AH00067,Dokuma,,Relaxed,Kısa,Cool & Comfort,Balon Kol,Düz,Kare Yaka,Siyah,,,Ramadan,,Midi,A-line,Kokteyl,Brode,,,,,Tüm Yaş Grupları,,TR,DSM Grup Danışmanlık İletişim ve Satış Ticaret A.Ş.,,,,
TRENDYOLMİLLA Mürdüm Düz  Dokuma Elbise TWOAW24EL00369,Dokuma,Polyester,Regular,Uzun,Smart,Standart Kol,Düz,Kruvaze,Mor,Gipeli,Cepsiz,,Astarsız,Mini,A-line,Gündüz / Gece,Aerobin,,Kemersiz,Hayır,,Tüm Yaş Grupları,Kış,TR,DSM Grup Danışmanlık İletişim ve Satış Ticaret A.Ş.,,,,
TRENDYOLMİLLA Mavi Çiçekli Keten Görünümlü Midi Dokuma Elbise TWOSS25EL00045,Dokuma,,Regular,Askılı,Cool & Comfort,Standart Kol,Çiçekli,Kalp Yaka,Mavi,,,Vacation,Astarsız,Midi,Skater,Casual/Günlük,Flamlı Pamuk,,,,,,Yaz,TR,DSM Grup Danışmanlık İletişim ve Satış Ticaret A.Ş.,Eteği Belden Açılan,,,
TRENDYOLMİLLA Pembe A-Kesim Taş Aksesuar Detaylı Dokuma Kısa Şık Elbise TPRSS25EL00196,Dokuma,,Fitted,Askılı,Smart,Standart Kol,Düz,Kare Yaka,Pembe,Taş Aksesuar,,,Astarlı,Mini,Skater,Şık/Gece,Finike,,,,,,,TR,DSM Grup Danışmanlık İletişim ve Satış Ticaret A.Ş.,Eteği Belden Açılan,,,
