Ürün Adı,Kumaş Tipi,Materyal,Kalıp,Kol Boyu,Persona,Kol Tipi,Desen,Yaka Tipi,Renk,Ürün Detayı,Cep,Koleksiyon,Astar Durumu,Boy,Siluet,Ortam,Dokuma Tipi,Baskı/Nakış Tekniği,Kemer/Kuşak Durumu,Sürdürülebilirlik Detayı,Paket İçeriği,Yaş,Sezon,Menşei,Üretici Bilgisi,Ek Özellik,Kapama Şekli,Kalınlık,Kap
TRENDYOLMİLLA Bordo Kalın Askılı Fitted/Vücuda Oturan Esnek Örme Maxi Kalem Elbise TWOSS24EL00137,Örme,Polyester,Slim,Askılı,Cool & Comfort,Standart Kol,Düz,Kare Yaka,Bordo,,,,Astarsız,Maxi,Bodycone,Casual/Günlük,Kalın Sandy,,Kemersiz,Hayır,,Tüm Yaş Grupları,,TR,DSM Grup Danışmanlık İletişim ve Satış Ticaret A.Ş.,,,,
Trendyol Curve Siyah Sırtı Cutout Detaylı Örme Büyük Beden Elbise TBBSS25AH00064,Örme,,Relaxed,Kısa,Cool & Comfort,Standart Kol,Düz,Kare Yaka,Siyah,,,,,Mini,A-line,Casual/Günlük,Krep,,,,,,,TR,DSM Grup Danışmanlık İletişim ve Satış Ticaret A.Ş.,,,,
Trendyol Curve Siyah Sandy Örme Büyük Beden Elbise,Örme,Polyester Karışımlı,Slim,Uzun,Cool & Comfort,Standart Kol,Düz,Asimetrik Yaka,Siyah,,Cepsiz,Ramadan,Astarsız,Maxi,A-line,Casual/Günlük,Sandy,,Kemersiz,Hayır,Tekli,Tüm Yaş Grupları,İlkbahar / Sonbahar,TR,DSM Grup Danışmanlık İletişim ve Satış Ticaret A.Ş.,,,,
TRENDYOLMİLLA Pembe Kuşaklı Shift Boyundan Bağlamalı Halter Yaka Shally Maxi Dokuma Elbise TWOSS24EL00872,Dokuma,Viskoz Karışımlı,Regular,Kolsuz,Cool & Comfort,Standart Kol,Çiçekli,Halter Yaka,Pembe,Lastikli,,,Astarlı,Maxi,A-line,Gündüz / Gece,Shally,,Kemersiz,Hayır,,Tüm Yaş Grupları,Yaz,TR,DSM Grup Danışmanlık İletişim ve Satış Ticaret A.Ş.,A Kesim,,,
TRENDYOLMİLLA Siyah Astarlı Dokuma Saten Şık Abiye Elbise TPRSS19BB0058,Dokuma,Polyester,Fitted,Askılı,Smart,Standart Kol,Düz,Degaje Yaka,Siyah,,,,Astarlı,Midi,Shift,Şık/Gece,Saten,,Kemersiz,Hayır,,Tüm Yaş Grupları,Yaz,TR,DSM Grup Danışmanlık İletişim ve Satış Ticaret A.Ş.,,,,
TRENDYOLMİLLA Siyah A-Kesim Volanlı Düğme Detaylı Mini Dokuma Elbise TWOSS23EL02259,Dokuma,Polyester Karışımlı,Regular,Kolsuz,Office,Standart Kol,Düz,V Yaka,Siyah,Düğmeli,,,Astarsız,Mini,A-line,Business,Finike,,Kemersiz,Hayır,,Tüm Yaş Grupları,Yaz,TR,DSM Grup Danışmanlık İletişim ve Satış Ticaret A.Ş.,A Kesim,,,
Trendyol Curve Siyah Kolsuz Fermuarlı Dokuma Büyük Beden Elbise TBBSS25AH00059,Dokuma,,Relaxed,Kolsuz,Fashion Forward,Standart Kol,Düz,V Yaka,Siyah,,,,,Midi,A-line,Gündüz / Gece,Terrycotton,,,,,,,TR,DSM Grup Danışmanlık İletişim ve Satış Ticaret A.Ş.,,,,
TRENDYOLMİLLA Siyah A-Kesim Poplin Dokuma Kısa Elbise TPRSS25EL00210,Dokuma,,Fitted,Kısa,Fashion Forward,Standart Kol,Düz,Kare Yaka,Siyah,,,Ramadan,Astarsız,Mini,Skater,Şık/Gece,Poplin,,,,,,,TR,DSM Grup Danışmanlık İletişim ve Satış Ticaret A.Ş.,Eteği Belden Açılan,,,
TRENDYOLMİLLA Kahverengi Leopar Desenli Düz Kesim Mini Saten Dokuma Elbise TWOSS24EL01065,Dokuma,Dokuma,Regular,Kolsuz,Feminine,Standart Kol,Animal,Bisiklet Yaka,Kahverengi,,Cepsiz,,Astarlı,Mini,Shift,Gündüz / Gece,Saten,,Kemersiz,Hayır,Tekli,Tüm Yaş Grupları,,TR,DSM Grup Danışmanlık İletişim ve Satış Ticaret A.Ş.,Düz Kesim,,,
TRENDYOLMİLLA Çok Renkli Tek Kol Vücuda Oturan Aksesuar Detaylı Tül Esnek Örme Midi Kalem Elbise TWOSS24EL00174,Örme,Polyester,Slim,Kolsuz,Cool & Comfort,Tek Kol,Çiçekli,Asimetrik Yaka,Çok Renkli,Aksesuar Detaylı,,Ramadan,Astarlı,Midi,Bodycone,Gündüz / Gece,Tül,,Kemersiz,Hayır,,Tüm Yaş Grupları,Yaz,TR,DSM Grup Danışmanlık İletişim ve Satış Ticaret A.Ş.,,,,
TRENDYOLMİLLA Indigo Düz Kesim Maxi Dokuma Elbise TWOSS25EL00247,Dokuma,,Relaxed,Askılı,Cool & Comfort,Standart Kol,Düz,V Yaka,Mavi,,,Giy-Çık,Astarsız,Maxi,Shift,Casual/Günlük,Aerobin,,,,,,Yaz,TR,DSM Grup Danışmanlık İletişim ve Satış Ticaret A.Ş.,Düz Kesim,,,
Trendyol Curve Yeşil Tül Örme Büyük Beden Elbise,Örme,,Relaxed,Kısa,Cool & Comfort,Balon Kol,Geometrik,Kare Yaka,Yeşil,,,,,Mini,Skater,Casual/Günlük,Tül,,,,,,,TR,DSM Grup Danışmanlık İletişim ve Satış Ticaret A.Ş.,,,,
TRENDYOLMİLLA Zümrüt Yeşili Düz Tek Omuzlu Drapeli Fitted/Vücuda Oturan Esnek Örme Elbise TWOSS24EL00100,Örme,Polyester Karışımlı,Slim,Kolsuz,Smart,Tek Kol,Düz,Asimetrik Yaka,Yeşil,Büzgülü,,,Astarsız,Midi,Bodycone,Casual/Günlük,Kalın Sandy,,Kemersiz,Hayır,,Tüm Yaş Grupları,Yaz,TR,DSM Grup Danışmanlık İletişim ve Satış Ticaret A.Ş.,,,,
TRENDYOLMİLLA Haki Skater/Belden Açılan Kruvaze Fitilli Esnek Midi Örme Elbise TWOAW25EL00511,Örme,,Regular,Uzun,Cool & Comfort,Standart Kol,Düz,Kruvaze,Haki,Örme Detaylı,,Ramadan,Astarsız,Mini,Skater,Casual/Günlük,Kaşkorse,,,Hayır,,,Kış,TR,DSM Grup Danışmanlık İletişim ve Satış Ticaret A.Ş.,Ek Özellik Mevcut Değil,,,
TRENDYOLMİLLA Kırmızı A Kesim Mini Dokuma Elbise TWOAW25EL00192,Dokuma,Polyester Karışımlı,Regular,Kolsuz,Smart,Standart Kol,Düz,Bisiklet Yaka,Kırmızı,,Cepsiz,,Astarlı,Mini,A-line,Business,Finike,Baskısız,Kemersiz,Hayır,Tekli,Tüm Yaş Grupları,Tüm Sezonlar,TR,DSM Grup Danışmanlık İletişim ve Satış Ticaret A.Ş.,A Kesim,,,
TRENDYOLMİLLA Yağ Yeşili A Kesim Korsaj Detaylı V Yaka Maxi Dokuma Elbise TWOSS24EL00620,Dokuma,Polyester Karışımlı,Regular,Kısa,Cool & Comfort,Standart Kol,Düz,V Yaka,Yeşil,,,,Astarsız,Maxi,A-line,Casual/Günlük,Crinkle,,Kemersiz,Hayır,,Tüm Yaş Grupları,Yaz,TR,DSM Grup Danışmanlık İletişim ve Satış Ticaret A.Ş.,A Kesim,,,
Trendyol Curve Siyah Beyaz Gömlek Yaka Uzun Kol Düğmeli Tüvit Elbise TBBAW24AH00026,Dokuma,Polyester Karışımlı,Fitted,Uzun,Cool & Comfort,Standart Kol,Ekose / Kareli,Gömlek Yaka,Siyah,,Cepsiz,Büyük Beden,Astarsız,Mini,Basic,Casual/Günlük,Tüvit,,Kemersiz,Hayır,,Tüm Yaş Grupları,Kış,TR,DSM Grup Danışmanlık İletişim ve Satış Ticaret A.Ş.,,,,
TRENDYOLMİLLA Mavi Dikiş Detaylı Fitted/Vücuda Oturan Mini Denim Elbise TWOSS24EL00284,Denim,,Fitted,Kolsuz,Fashion Forward,Standart Kol,Düz,Bisiklet Yaka,Mavi,,,,Astarsız,Midi,Basic,Casual/Günlük,Comfort,,,,,,Yaz,TR,,,,,
TRENDYOLMİLLA Pembe Çiçek Desenli Belden Açılan Mini Dokuma Elbise TWOSS23EL02008,Dokuma,Polyester,Regular,Kolsuz,Feminine,Standart Kol,Çiçekli,Dik Yaka,Pembe,Fırfırlı,Cepsiz,,Astarlı,Mini,Skater,Gündüz / Gece,Şifon,,Kemersiz,Hayır,,Tüm Yaş Grupları,Yaz,TR,DSM Grup Danışmanlık İletişim ve Satış Ticaret A.Ş.,Eteği Belden Açılan,,,
TRENDYOLMİLLA Pembe Rahat Kesim V Yaka Midi Dokuma Elbise TWOSS23EL00882,Dokuma,Polyester,Relaxed,Kolsuz,Cool & Comfort,Standart Kol,Düz,V Yaka,Pembe,,Cepsiz,,Astarsız,Midi,Shift,Casual/Günlük,Aerobin,,Kemersiz,Hayır,,Tüm Yaş Grupları,Yaz,TR,DSM Grup Danışmanlık İletişim ve Satış Ticaret A.Ş.,Düz Kesim,,,
TRENDYOLMİLLA Siyah Maxi Dokuma Büzgü Detaylı Plaj Elbisesi TBESS25EL00100,Dokuma,,Fitted,Kolsuz,Feminine,Standart Kol,Düz,V Yaka,Siyah,,,,Astarsız,Maxi,Skater,Beachwear,Shally,,,,,,,TR,DSM Grup Danışmanlık İletişim ve Satış Ticaret A.Ş.,,,,
TRENDYOLMİLLA Sarı Çiçek Desenli Gipeli Balon Etek Detaylı Mini Dokuma Elbise TWOSS24EL01141,Dokuma,,Regular,Kolsuz,Cool & Comfort,Standart Kol,Ekose / Kareli,Straplez,Sarı,,,,Astarsız,Mini,Skater,Casual/Günlük,Poplin,,,,,,,TR,DSM Grup Danışmanlık İletişim ve Satış Ticaret A.Ş.,Eteği Belden Açılan,,,
Trendyol Curve Siyah Kemerli Dokuma Gömlek Elbise TBBSS23AH00277,Dokuma,,Relaxed,Kolsuz,Cool & Comfort,Standart Kol,Düz,Gömlek Yaka,Siyah,,,,Astarsız,Maxi,Gömlek Elbise,Casual/Günlük,Aerobin,,Kemerli,Hayır,,Tüm Yaş Grupları,Yaz,TR,DSM Grup Danışmanlık İletişim ve Satış Ticaret A.Ş.,,,,
Trendyol Curve Antrasit Modal Yumuşak Midi Dokuma Büyük Beden Elbise TBBSS25AH00134,Dokuma,,Relaxed,Askılı,Cool & Comfort,Kalın Askılı,Çiçekli,Kare Yaka,Gri,,,Büyük Beden,,Midi,A-line,Casual/Günlük,Shally,,,,,Tüm Yaş Grupları,,TR,DSM Grup Danışmanlık İletişim ve Satış Ticaret A.Ş.,,,,
TRENDYOLMİLLA Kahverengi Puantiyeli A Kesim Volanlı / Fırfırlı Mini Dokuma Elbise TWOSS25EL00454,Dokuma,,Regular,Askılı,Feminine,Standart Kol,Puantiyeli,Kruvaze,Kahverengi,Volanlı / Fırfırlı,,,Astarlı,Midi,A-line,Gündüz / Gece,Şifon,,,,,,,TR,DSM Grup Danışmanlık İletişim ve Satış Ticaret A.Ş.,A Kesim,,,
TRENDYOLMİLLA Limited Edition Kırmızı Fitted/Vücuda Oturan Esnek Mini Örme Elbise TWOAW25EL00303,Örme,Polyester Karışımlı,Slim,Uzun,Fashion Forward,Standart Kol,Düz,Dik Yaka,Kırmızı,,Cepsiz,,Astarsız,Mini,Bodycone,Casual/Günlük,Kalın Sandy,,Kemersiz,Hayır,,Tüm Yaş Grupları,Kış,TR,DSM Grup Danışmanlık İletişim ve Satış Ticaret A.Ş.,,,,
TRENDYOLMİLLA Siyah Tek Omuz Mini Dokuma %100 Pamuk Volanlı Plaj Elbisesi TBESS25EL00073,Dokuma,,Fitted,Askılı,Feminine,Tek Kol,Düz,Tek Omuz,Siyah,Volanlı / Fırfırlı,,,Astarsız,Mini,Skater,Beachwear,Vual,,,,,,,TR,DSM Grup Danışmanlık İletişim ve Satış Ticaret A.Ş.,,,,
TRENDYOLMİLLA Siyah Animal Desenli Eteği Büzgü Detaylı Dokuma Elbise TWOAW25EL00380,Dokuma,Dokuma,Fitted,Uzun,Fashion Forward,Standart Kol,Soyut,V Yaka,Siyah,,Cepsiz,,Astarsız,Midi,Bodycone,Gündüz / Gece,Belmando,Baskısız,Kemersiz,Hayır,Tekli,Tüm Yaş Grupları,İlkbahar / Sonbahar,TR,DSM Grup Danışmanlık İletişim ve Satış Ticaret A.Ş.,,,,
TRENDYOLMİLLA Ekru Maxi Dokuma Gipe Detaylı Plaj Elbisesi TBESS25EL00030,Dokuma,,Oversize,Askılı,Fashion Forward,Tek Kol,Baskılı,Bisiklet Yaka,Ekru,,,,Astarsız,Midi,Ceket Elbise,Beachwear,Micro,,,,,,Yaz,TR,DSM Grup Danışmanlık İletişim ve Satış Ticaret A.Ş.,,,,
TRENDYOLMİLLA Tarçın Vücuda Oturan Cut Out/Pencere Detaylı Örme Kısa Şık Elbise TPRSS25EL00193,Örme,,Fitted,Kolsuz,Feminine,Standart Kol,Düz,Bisiklet Yaka,Kahverengi,Cut outlı,,,Astarsız,Mini,Bodycone,Şık/Gece,Sandy,,,,,,,TR,DSM Grup Danışmanlık İletişim ve Satış Ticaret A.Ş.,Vücudu Saran,,,
TRENDYOLMİLLA Siyah Düz Volanlı / Fırfırlı Mini Esnek  Örme Elbise TWOSS25EL00388,Örme,,Slim,Kolsuz,Fashion Forward,Standart Kol,Düz,Havuz Yaka,Siyah,Volanlı / Fırfırlı,,,Astarlı,Mini,Eteği Fırfırlı,Gündüz / Gece,Kaşkorse,,,,,,,TR,DSM Grup Danışmanlık İletişim ve Satış Ticaret A.Ş.,,,,
TRENDYOLMİLLA Turuncu Shift Boyundan Bağlamalı Halter Yaka Shally Maxi Dokuma Elbise TWOSS24EL00872,Dokuma,Viskoz Karışımlı,Regular,Kolsuz,Cool & Comfort,Standart Kol,Çiçekli,Halter Yaka,Turuncu,Lastikli,,,Astarlı,Maxi,A-line,Gündüz / Gece,Shally,,Kemersiz,Hayır,,Tüm Yaş Grupları,Yaz,TR,DSM Grup Danışmanlık İletişim ve Satış Ticaret A.Ş.,A Kesim,,,
TRENDYOLMİLLA Indigo Kruvaze Bağlama Detaylı Midi Dokuma Elbise TWOSS24EL00521,Dokuma,Polyester,Regular,Uzun,Cool & Comfort,Standart Kol,Düz,Kruvaze,Mavi,Bağlama Detaylı,Cepsiz,,Astarsız,Midi,Kruvaze,Casual/Günlük,Modal Kumaş,,Kemersiz,Hayır,,Tüm Yaş Grupları,İlkbahar / Sonbahar,TR,DSM Grup Danışmanlık İletişim ve Satış Ticaret A.Ş.,,,,
Edit by Trendyol Siyah Kısa Kol Bisiklet Yaka Mini Örme T-shirt Elbise TEDSS25EL00008,Örme,,Regular,Kısa,Cool & Comfort,Standart Kol,Düz,Bisiklet Yaka,Siyah,,,,Astarsız,Mini,T-shirt Elbise,Casual/Günlük,Süprem,,,,,,,TR,,,,,
TRENDYOLMİLLA Siyah Maxi Dokuma Cut Out/Pencere Plaj Elbisesi TBESS25EL00079,Dokuma,,Fitted,Askılı,Fashion Forward,Tek Kol,Düz,Bisiklet Yaka,Siyah,Cut outlı,,,Astarsız,Maxi,Bodycone,Beachwear,Sandy,,,,,,,TR,DSM Grup Danışmanlık İletişim ve Satış Ticaret A.Ş.,,,,
TRENDYOLMİLLA Kahverengi Düz Midi Fitilli A-Line Triko Elbise TWOSS25EL00503,Triko,,Slim,Askılı,Cool & Comfort,Standart Kol,Düz,Kare Yaka,Kahverengi,,,Ramadan,Astarsız,Midi,Basic,Casual/Günlük,Fitilli,,,,,,,TR,DSM Grup Danışmanlık İletişim ve Satış Ticaret A.Ş.,,,İnce,
TRENDYOLMİLLA Bordo Maxi Volanlı Kare Yaka Fitted/Vücuda Oturan Maxi Esnek Örme Elbise TWOAW24EL00613,Örme,Polyester Karışımlı,Slim,Uzun,Smart,Standart Kol,Düz,Kare Yaka,Bordo,,Cepsiz,Ramadan,Astarsız,Maxi,Bodycone,Gündüz / Gece,Kalın Sandy,Baskısız,Kemersiz,Hayır,Tekli,Tüm Yaş Grupları,,TR,DSM Grup Danışmanlık İletişim ve Satış Ticaret A.Ş.,,,,
TRENDYOLMİLLA Lacivert Premium İplik/Özel İplik Dokulu Maxi Büzgülü Hırka-Elbise Triko Elbise TWOSS25EL00497,Triko,,Slim,Askılı,Cool & Comfort,Standart Kol,Dokulu,Kalp Yaka,Lacivert,,,Ramadan,Astarsız,Maxi,Bodycone,Casual/Günlük,Fitilli,,,,,,,TR,DSM Grup Danışmanlık İletişim ve Satış Ticaret A.Ş.,,,İnce,
TRENDYOLMİLLA Siyah Kalın Askılı Fitted/Vücuda Oturan Esnek Örme Maxi Kalem Elbise TWOSS24EL00137,Örme,Polyester,Slim,Askılı,Cool & Comfort,Standart Kol,Düz,Kare Yaka,Siyah,,,,Astarsız,Maxi,Bodycone,Casual/Günlük,Kalın Sandy,,Kemersiz,Hayır,,Tüm Yaş Grupları,,TR,DSM Grup Danışmanlık İletişim ve Satış Ticaret A.Ş.,,,,
TRENDYOLMİLLA Kahverengi Baskılı Büzgü / Drape Maxi  Örme Elbise TWOAW25EL00408,Örme,Polyester Karışımlı,Regular,Uzun,Fashion Forward,Standart Kol,Baskılı,Bisiklet Yaka,Kahverengi,Büzgülü,Cepsiz,Ramadan,Astarlı,Maxi,A-line,Casual/Günlük,Tül,Baskısız,Kemersiz,Hayır,Tekli,Tüm Yaş Grupları,Kış,TR,DSM Grup Danışmanlık İletişim ve Satış Ticaret A.Ş.,,,,
Trendyol Curve Siyah Dik Yaka Transparan Detaylı Bodycon Triko Elbise TBBAW23AH00180,Triko,Akrilik,Fitted,Uzun,Cool & Comfort,Standart Kol,Düz,Dik Yaka,Siyah,,Cepsiz,Büyük Beden,Astarsız,Mini,Bodycone,Casual/Günlük,Tek Plaka,,Kemersiz,Hayır,Tekli,Tüm Yaş Grupları,Kış,TR,DSM Grup Danışmanlık İletişim ve Satış Ticaret A.Ş.,Ek Özellik Mevcut Değil,,,
TRENDYOLMİLLA Siyah Drape Detaylı Dokuma Maxi Elbise TWOSS24EL01128,Dokuma,,Regular,Askılı,Fashion Forward,Standart Kol,Düz,Kalp Yaka,Siyah,,,,Astarsız,Maxi,A-line,Gündüz / Gece,Poplin,,,,,,,TR,DSM Grup Danışmanlık İletişim ve Satış Ticaret A.Ş.,A Kesim,,,
TRENDYOLMİLLA Ekru Mini Bisiklet Yaka Peplum Triko Elbise TWOSS25EL00309,Triko,,Regular,Kolsuz,Feminine,Standart Kol,Düz,Bisiklet Yaka,Ekru,,,Ramadan,Astarsız,Mini,A-line,Casual/Günlük,Çift Plaka,,,,,,,TR,DSM Grup Danışmanlık İletişim ve Satış Ticaret A.Ş.,,,Orta,
TRENDYOLMİLLA İndigo Bodycone/Vücuda Oturan Askılı Midi Örme Elbise TWOSS25EL00164,Örme,,Slim,Askılı,Cool & Comfort,Standart Kol,Düz,V Yaka,Mavi,,,,Astarsız,Midi,Bodycone,Casual/Günlük,Bürümcük,,,,,,Yaz,TR,DSM Grup Danışmanlık İletişim ve Satış Ticaret A.Ş.,,,,
TRENDYOLMİLLA Siyah Shift/Düz Mini Örme Elbise TWOSS25EL00162,Örme,,Regular,Kısa,Cool & Comfort,Standart Kol,Düz,Bisiklet Yaka,Siyah,,,Ramadan,Astarsız,Mini,Shift,Casual/Günlük,Scuba Krep,,,Hayır,,,Yaz,TR,DSM Grup Danışmanlık İletişim ve Satış Ticaret A.Ş.,,,,
TRENDYOLMİLLA Siyah Bürümcük Kemer Detaylı Sıfır Kol Midi Örme Elbise TWOSS25EL00665,Örme,,Regular,Kolsuz,Cool & Comfort,Standart Kol,Düz,Bisiklet Yaka,Siyah,Kemerli,,Ramadan,Astarsız,Midi,A-line,Casual/Günlük,Bürümcük,,,,,,,TR,DSM Grup Danışmanlık İletişim ve Satış Ticaret A.Ş.,,,,
TRENDYOLMİLLA Çok Renkli Desenli A-Kesim Askılı Midi Astarlı Dokuma Elbise TWOSS23EL00989,Dokuma,Polyester,Regular,Askılı,Fashion Forward,Standart Kol,Etnik,V Yaka,Çok Renkli,,,,Astarlı,Maxi,A-line,Gündüz / Gece,Şifon,,Kemersiz,Hayır,,Tüm Yaş Grupları,Yaz,TR,DSM Grup Danışmanlık İletişim ve Satış Ticaret A.Ş.,A Kesim,,,
TRENDYOLMİLLA Çiçek Desenli Mini Dokuma Plaj Elbisesi TBESS25EL00090,Dokuma,,Fitted,Kısa,Feminine,Standart Kol,Düz,V Yaka,Çok Renkli,,,,Astarsız,Mini,Skater,Beachwear,Shally,,,,,,,TR,DSM Grup Danışmanlık İletişim ve Satış Ticaret A.Ş.,,,,
Trendyol Curve Siyah Basic Uzun Kol Gizli Fermuarlı Mini Dokuma Büyük Beden Elbise TBBAW25AH00054,Dokuma,Polyester Karışımlı,Fitted,Uzun,Cool & Comfort,Standart Kol,Düz,Bisiklet Yaka,Siyah,,Cepsiz,,Astarsız,Mini,Skater,Casual/Günlük,Finike,,Kemersiz,Hayır,,Tüm Yaş Grupları,İlkbahar / Sonbahar,TR,DSM Grup Danışmanlık İletişim ve Satış Ticaret A.Ş.,,,,
TRENDYOLMİLLA Siyah Ekose Baskılı Yırtmaçlı Dantel Detaylı Kare Yaka Askılı Midi Örme Elbise TWOSS25EL00473,Örme,,Regular,Askılı,Fashion Forward,Standart Kol,Ekose / Kareli,Kare Yaka,Siyah,Dantel Detaylı,,,Astarlı,Midi,Skater,Gündüz / Gece,Tül,,,,,,,TR,DSM Grup Danışmanlık İletişim ve Satış Ticaret A.Ş.,,,,
TRENDYOLMİLLA Mavi A-Kesim Dokuma Şık Abiye Elbise TPRSS24EL00160,Dokuma,Dokuma,Fitted,Kolsuz,Fashion Forward,Standart Kol,Düz,Straplez,Mavi,,Cepsiz,Ramadan,Astarsız,Midi,Skater,Şık/Gece,Jakar,Baskısız,Kemersiz,Hayır,Tekli,Tüm Yaş Grupları,Yaz,TR,DSM Grup Danışmanlık İletişim ve Satış Ticaret A.Ş.,,,,
TRENDYOLMİLLA Pembe Çiçek Desenli Kuşaklı Midi Dokuma Elbise TWOSS24EL00536,Dokuma,Polyester,Regular,Askılı,Feminine,Standart Kol,Soyut,V Yaka,Pembe,Kuşaklı,,,Astarlı,Midi,A-line,Gündüz / Gece,Şifon,,Kemersiz,Hayır,,Tüm Yaş Grupları,Yaz,TR,DSM Grup Danışmanlık İletişim ve Satış Ticaret A.Ş.,A Kesim,,,
TRENDYOLMİLLA Mor Çiçek Baskılı Askılı V Yaka Büzgülü Eteği Volanlı Fitilli Esnek Maxi Örme Elbise TWOSS25EL00239,Örme,,Regular,Askılı,Cool & Comfort,Standart Kol,Çiçekli,V Yaka,Mor,,,Ramadan,Astarsız,Maxi,Skater,Casual/Günlük,Polyester Kaşkorse,,,,,,,TR,DSM Grup Danışmanlık İletişim ve Satış Ticaret A.Ş.,,,,
TRENDYOLMİLLA Fuşya Animal Desenli A Kesim Melek Kol Astarlı Şifon Midi Dokuma Elbise TWOSS23EL01372,Dokuma,Polyester,Regular,Kısa,Feminine,Mendil Kol,Animal,Bisiklet Yaka,Pembe,,Cepsiz,,Astarlı,Midi,A-line,Gündüz / Gece,Şifon,,Kemersiz,Hayır,,Tüm Yaş Grupları,Yaz,TR,DSM Grup Danışmanlık İletişim ve Satış Ticaret A.Ş.,A Kesim,,,
TRENDYOLMİLLA Antrasit Askılı Sırt Gipe Detaylı Fitilli Maxi Esnek Örme Maxi Elbise TWOSS24EL00275,Örme,Polyester Karışımlı,Regular,Askılı,Cool & Comfort,Standart Kol,Düz,Kare Yaka,Gri,Gipeli,Cepsiz,,Astarsız,Maxi,A-line,Casual/Günlük,Polyester Kaşkorse,,Kemersiz,Hayır,,Tüm Yaş Grupları,,TR,DSM Grup Danışmanlık İletişim ve Satış Ticaret A.Ş.,,,,
TRENDYOLMİLLA Siyah Düz Eteği Belden Açılan Mini Dokuma Elbise TWOSS25EL00397,Dokuma,,Regular,Askılı,Fashion Forward,Standart Kol,Düz,Kalp Yaka,Siyah,,,,Astarsız,Mini,Skater,Casual/Günlük,Finike,,,,,,,TR,DSM Grup Danışmanlık İletişim ve Satış Ticaret A.Ş.,Eteği Belden Açılan,,,
TRENDYOLMİLLA Kırmızı Balıkçı Yaka Shift/Düz Mini Selanik Uzun Kollu Örme Elbise TWOAW20EL1110,Örme,Pamuklu,Relaxed,Truvakar Kol,Cool & Comfort,Düşük Kol,Düz,Balıkçı Yaka,Kırmızı,,Cepsiz,Ramadan,Astarsız,Kısa / Mini,Shift,Casual/Günlük,Selanik,,Kemersiz,Hayır,,21 - 40 Yaş,Kış,TR,DSM Grup Danışmanlık İletişim ve Satış Ticaret A.Ş.,,,,
TRENDYOLMİLLA Çok Renkli A Kesim Astarlı Pencere/Cut Out Detaylı Çiçek Desenli Maxi Dokuma Elbise TWOSS20EL1270,Dokuma,Polyester,Regular,Askılı,Feminine,Standart Kol,Çiçekli,V Yaka,Çok Renkli,Cut Out / Volan,,,Astarlı,Maxi,A-line,Gündüz / Gece,Şifon,,Kemersiz,Hayır,,Tüm Yaş Grupları,Yaz,TR,DSM Grup Danışmanlık İletişim ve Satış Ticaret A.Ş.,A Kesim,,,
Trendyol Curve Mavi Rigid Denim Gömlek Yaka Bağcıklı Büyük Beden Elbise TBBAW25AH00085,Denim,Rigid,Relaxed,Uzun,Cool & Comfort,Standart Kol,Düz,Gömlek Yaka,Mavi,,Cepsiz,,Astarsız,Mini,Shift,Casual/Günlük,Rigid,,Kemersiz,Hayır,Tekli,Tüm Yaş Grupları,İlkbahar / Sonbahar,TR,DSM Grup Danışmanlık İletişim ve Satış Ticaret A.Ş.,,,,
TRENDYOLMİLLA Bordo Pili Detaylı Mini Örme Elbise TWOSS25EL00252,Örme,,Slim,Kolsuz,Feminine,Standart Kol,Düz,Bisiklet Yaka,Bordo,,,,Astarsız,Mini,Eteği Fırfırlı,Casual/Günlük,İnterlok,,,,,,Yaz,TR,DSM Grup Danışmanlık İletişim ve Satış Ticaret A.Ş.,,,,
Trendyol Curve Kahverengi Relaxed Ayarlanabilir Askılı Uzun Dokuma Büyük Beden Elbise TBBSS24AH00187,Dokuma,Polyester,Relaxed,Kolsuz,Cool & Comfort,İnce Askılı,Düz,Kare Yaka,Kahverengi,,,,,Midi,A-line,Casual/Günlük,Aerobin,,Kemersiz,Hayır,,Tüm Yaş Grupları,,TR,DSM Grup Danışmanlık İletişim ve Satış Ticaret A.Ş.,,,,
Trendyol Curve Siyah Fitilli Yırtmaçlı Midi Boy Triko Elbise&Bolero Takım TBBAW25AH00070,Triko,Triko,Fitted,Uzun,Cool & Comfort,Düşük Kol,Düz,Kalp Yaka,Siyah,,,,Astarsız,Midi,Bodycone,Casual/Günlük,Fitilli,,Kemersiz,Hayır,,Tüm Yaş Grupları,Kış,TR,DSM Grup Danışmanlık İletişim ve Satış Ticaret A.Ş.,,,,
TRENDYOLMİLLA Saks  A Kesim Askılı Göğüs Detaylı Midi Dokuma Elbise TWOSS23EL02057,Dokuma,Polyester,Regular,Askılı,Cool & Comfort,Standart Kol,Düz,V Yaka,Mavi,,,,Astarsız,Midi,A-line,Casual/Günlük,Aerobin,,Kemersiz,Hayır,,Tüm Yaş Grupları,Yaz,TR,DSM Grup Danışmanlık İletişim ve Satış Ticaret A.Ş.,A Kesim,,,
Trendyol Curve Mavi Belden Açılan/Skater V Yaka Denim Elbise TBBSS23AH00078,Denim,Pamuk - Elastan,Relaxed,Kısa,Cool & Comfort,Standart Kol,Düz,V Yaka,Mavi,,,,,Mini,A-line,Casual/Günlük,Comfort,,Kemersiz,Hayır,,Tüm Yaş Grupları,Yaz,TR,DSM Grup Danışmanlık İletişim ve Satış Ticaret A.Ş.,,,,
TRENDYOLMİLLA Pembe Çiçek Baskılı Kruvaze V Yaka Skater/Belden Açılan Fitilli Esnek Örme Mini TWOSS21EL0241,Örme,Polyester Karışımlı,Regular,Kısa,Feminine,Standart Kol,Çiçekli,Kruvaze,Pembe,,Cepsiz,Ramadan,Astarsız,Mini,Skater,Casual/Günlük,Polyester Kaşkorse,,Kemersiz,Hayır,Tekli,Tüm Yaş Grupları,Yaz,TR,DSM Grup Danışmanlık İletişim ve Satış Ticaret A.Ş.,,,,
TRENDYOLMİLLA Lacivert V Yaka Midi Jile Dokuma Elbise TWOAW25EL00146,Dokuma,%100 Pamuk,Regular,Askılı,Cool & Comfort,Standart Kol,Düz,V Yaka,Lacivert,,Cepsiz,,Astarsız,Midi,Jile,Casual/Günlük,Gabardin,Baskısız,Kemersiz,Hayır,Tekli,Tüm Yaş Grupları,İlkbahar / Sonbahar,TR,DSM Grup Danışmanlık İletişim ve Satış Ticaret A.Ş.,,,,
TRENDYOLMİLLA Siyah Baskılı Ayarlanabilir Askılı A-Line Bürümcük/Dokulu Örme Maxi Elbise TWOSS24EL00060,Örme,Polyester,Relaxed,Askılı,Cool & Comfort,Standart Kol,Düz,Kare Yaka,Siyah,Sırt Dekolteli,,Ramadan,Astarsız,Maxi,A-line,Casual/Günlük,Bürümcük,,Kemersiz,Hayır,,Tüm Yaş Grupları,Yaz,TR,DSM Grup Danışmanlık İletişim ve Satış Ticaret A.Ş.,,,,
TRENDYOLMİLLA Kahverengi Gömlek Yaka Detaylı Şifon Elbise TPRAW25EL00110,Dokuma,Polyester,Fitted,Uzun,Fashion Forward,Standart Kol,Düz,Gömlek Yaka,Kahverengi,Fırfırlı,,,Astarlı,Mini,Skater,Şık/Gece,Şifon,,Kemersiz,Hayır,,Tüm Yaş Grupları,,TR,DSM Grup Danışmanlık İletişim ve Satış Ticaret A.Ş.,,,,
TRENDYOLMİLLA Bej A Kesim Volanlı Viskon Dokuma Elbise Dokuma Elbise TWOSS24EL01053,Dokuma,Polyester,Regular,Kısa,Feminine,Büzgülü/Fırfırlı Kol,Düz,V Yaka,Bej,Lastikli,,,Astarsız,Midi,Skater,Gündüz / Gece,Aerobin,,Kemersiz,Hayır,,Tüm Yaş Grupları,Yaz,TR,DSM Grup Danışmanlık İletişim ve Satış Ticaret A.Ş.,Eteği Belden Açılan,,,
TRENDYOLMİLLA Kahverengi Mini Dokuma Cut Out/Pencere Flamlı Pamuk Plaj Elbisesi TBESS25EL00102,Dokuma,,Fitted,Kısa,Fashion Forward,Standart Kol,Düz,Bisiklet Yaka,Kahverengi,Cut outlı,,,Astarsız,Mini,Bodycone,Beachwear,Flamlı Pamuk,,,,,,,TR,DSM Grup Danışmanlık İletişim ve Satış Ticaret A.Ş.,Cut Out,,,
Trendyol Curve Siyah Gömlek Yaka Gold Düğmeli Çıkarılabilir Kemerli Büyük Beden Mini Dokuma Elbise TBBAW25AH00050,Dokuma,Elastan,Fitted,Kolsuz,Smart/Office,Standart Kol,Renk Bloklu,Gömlek Yaka,Siyah,,Cepsiz,Büyük Beden,Astarsız,Mini,Shift,Casual/Günlük,Finike,,Kemerli,Hayır,,Tüm Yaş Grupları,İlkbahar / Sonbahar,TR,DSM Grup Danışmanlık İletişim ve Satış Ticaret A.Ş.,,,,
TRENDYOLMİLLA Pembe Düz Kesim Taş Detaylı Mini Dokuma Elbise TWOSS25EL00447,Dokuma,,Relaxed,Kolsuz,Feminine,Standart Kol,Düz,Bisiklet Yaka,Pembe,,,,Astarsız,Mini,Shift,Gündüz / Gece,Finike,,,,,,,TR,DSM Grup Danışmanlık İletişim ve Satış Ticaret A.Ş.,Düz Kesim,,,
TRENDYOLMİLLA Haki Düz Gipeli Midi Tek Kol Bürümcük/Dokulu Örme Elbise TWOSS25EL00540,Örme,,Regular,Kolsuz,Cool & Comfort,Tek Kol,Düz,Asimetrik Yaka,Haki,Gipeli,,Ramadan,Astarsız,Midi,Skater,Casual/Günlük,Bürümcük,,,,,,,TR,DSM Grup Danışmanlık İletişim ve Satış Ticaret A.Ş.,,,,
TRENDYOLMİLLA Çok Renkli Soyut Desenli Örme Şık Abiye Elbise TPRSS24EL00150,Örme,Polyester,Fitted,Askılı,Fashion Forward,Standart Kol,Soyut,Kare Yaka,Çok Renkli,,,,Astarlı,Midi,Bodycone,Şık/Gece,Tül,,Kemersiz,Hayır,,Tüm Yaş Grupları,Yaz,TR,DSM Grup Danışmanlık İletişim ve Satış Ticaret A.Ş.,Vücudu Saran,,,
TRENDYOLMİLLA Haki Düz Yarım Patlı Maxi  Dokuma Elbise TWOSS24EL00621,Dokuma,Polyester,Regular,Kısa,Cool & Comfort,Düşük Kol,Düz,Gömlek Yaka,Haki,Yarım Patlı,,,Astarsız,Maxi,A-line,Casual/Günlük,Aerobin,,Kemersiz,Hayır,,Tüm Yaş Grupları,Yaz,TR,DSM Grup Danışmanlık İletişim ve Satış Ticaret A.Ş.,A Kesim,,,
TRENDYOLMİLLA Lila Düz Rahat Kesim Volanlı / Fırfırlı Mini Dokuma Elbise TWOSS25EL00427,Dokuma,,Regular,Kolsuz,Cool & Comfort,Büzgülü/Fırfırlı Kol,Düz,Hakim Yaka,Mor,Volanlı / Fırfırlı,,,Astarsız,Mini,Shift,Casual/Günlük,Aerobin,,,,,,,TR,DSM Grup Danışmanlık İletişim ve Satış Ticaret A.Ş.,Düz Kesim,,,
Trendyol Curve Mavi Gömlek Yaka Cepli Comfort Denim Büyük Beden Elbise TBBSS25AH00088,Denim,,Fitted,Kolsuz,Cool & Comfort,Standart Kol,Düz,Gömlek Yaka,Mavi,,,,,Mini,Shift,Casual/Günlük,Comfort,,,,,,,TR,DSM Grup Danışmanlık İletişim ve Satış Ticaret A.Ş.,,,,
TRENDYOLMİLLA Limited Edition Beyaz Taş Baskılı Brode Dantel Mini Astarlı Elbise TPRSS25EL00231,Dokuma,,Fitted,Askılı,Fashion Forward,Standart Kol,Düz,V Yaka,Beyaz,Taş Aksesuar,,,Astarlı,Mini,Shift,Şık/Gece,Brode,,,,,,,TR,DSM Grup Danışmanlık İletişim ve Satış Ticaret A.Ş.,Eteği Belden Açılan,,,
