Ürün Adı,Kumaş Tipi,Materyal,Kalıp,Kol Boyu,Persona,Kol Tipi,Desen,Yaka Tipi,Renk,Ürün Detayı,Cep,Koleksiyon,Astar Durumu,Boy,Siluet,Ortam,Dokuma Tipi,Baskı/Nakış Tekniği,Kemer/Kuşak Durumu,Sürdürülebilirlik Detayı,Paket İçeriği,Yaş,Sezon,Menşei,Üretici Bilgisi,Ek Özellik,Kapama Şekli,Kalınlık,Kap
Trendyol Curve Siyah Düz Kesim Örme Elbise TBBSS22EL2365,Örme,Örme,Slim,Kısa,Cool & Comfort,Standart Kol,Düz,V Yaka,Siyah,,Cepsiz,Büyük Beden,Astarsız,Mini,Shift,Şık/Gece,Bürümcük,,Kemersiz,Hayır,Tekli,Tüm Yaş Grupları,Yaz,TR,DSM Grup Danışmanlık İletişim ve Satış Ticaret A.Ş.,,,,
TRENDYOLMİLLA Lacivert Mini Düğmeli Viskon Dokuma Elbise TWOAW23EL01310,Dokuma,,Regular,Uzun,Cool & Comfort,Standart Kol,Çiçekli,Gömlek Yaka,Lacivert,Düğmeli,Cepsiz,,Astarsız,Mini,A-line,Casual/Günlük,Shally,,Kemersiz,Hayır,,Tüm Yaş Grupları,Kış,TR,DSM Grup Danışmanlık İletişim ve Satış Ticaret A.Ş.,,Düğmeli,,
TRENDYOLMİLLA Bordo Vücuda Oturan Dokuma Midi Şık Elbise TPRSS25EL00189,Dokuma,,Fitted,Askılı,Smart,Standart Kol,Düz,Kalp Yaka,Bordo,,,,Astarsız,Midi,Bodycone,Şık/Gece,Finike,,,,,,,TR,DSM Grup Danışmanlık İletişim ve Satış Ticaret A.Ş.,Vücudu Saran,,,
TRENDYOLMİLLA Mavi Çiçek Desenli Düz Kesim Halter Yaka Mini Astarlı Şifon Dokuma Elbise TWOSS23EL02293,Dokuma,Polyester,Regular,Kolsuz,Feminine,Standart Kol,Çiçekli,Halter Yaka,Mavi,Fırfırlı,,,Astarlı,Mini,A-line,Gündüz / Gece,Şifon,,Kemersiz,Hayır,,Tüm Yaş Grupları,Yaz,TR,DSM Grup Danışmanlık İletişim ve Satış Ticaret A.Ş.,A Kesim,,,
Trendyol Curve Siyah Kaşkorse Örme Büyük Beden Elbise,Örme,Örme,Fitted,Uzun,Cool & Comfort,Standart Kol,Düz,Bisiklet Yaka,Siyah,,Cepsiz,,Astarsız,Mini,Bodycone,Casual/Günlük,Kaşkorse,,Kemersiz,Hayır,Tekli,Tüm Yaş Grupları,İlkbahar / Sonbahar,TR,DSM Grup Danışmanlık İletişim ve Satış Ticaret A.Ş.,,,,
TRENDYOLMİLLA Siyah Biye Detaylı 2 Katmanlı İçi Şortlu Tenis Örme Spor Elbise THMSS24EL00000,Örme,Polyester Karışımlı,Relaxed,Askılı,Fashion Forward,Standart Kol,Renk Bloklu,Asimetrik Yaka,Siyah,,Cepsiz,Sportswear,Astarsız,Mini,A-line,Sportswear,Dalgıç/Scuba,,Kemersiz,Hayır,,Tüm Yaş Grupları,Yaz,TR,DSM Grup Danışmanlık İletişim ve Satış Ticaret A.Ş.,,,,Kaplı
TRENDYOLMİLLA Çok Renkli Vücuda Oturan Fırfır Detaylı Tül Örme Şık Elbise TPRSS25EL00276,Örme,,Fitted,Askılı,Feminine,Standart Kol,Batik,Straplez,Çok Renkli,Fırfırlı,,,Astarlı,Midi,Bodycone,Kokteyl,Tül,,,,,,,TR,DSM Grup Danışmanlık İletişim ve Satış Ticaret A.Ş.,,,,
Edit by Trendyol Siyah Vücuda Oturan V Yaka Kadife Şık Kısa Elbise TEDAW25EL00060,Örme,Polyester,Fitted,Uzun,Fashion Forward,Standart Kol,Düz,V Yaka,Siyah,,,,Astarsız,Mini,Bodycone,Şık/Gece,Kadife,,Kemersiz,Hayır,,,,TR,DSM Grup Danışmanlık İletişim ve Satış Ticaret A.Ş.,,,,
TRENDYOLMİLLA Pembe Çiçek Baskılı Askılı V Yaka Büzgülü Vücuda Oturan Esnek Maxi Örme Elbise TWOSS25EL00474,Örme,,Regular,Askılı,Cool & Comfort,Büzgülü/Fırfırlı Kol,Çiçekli,V Yaka,Pembe,,,,Astarsız,Maxi,Bodycone,Casual/Günlük,Bürümcük,,,,,,,TR,DSM Grup Danışmanlık İletişim ve Satış Ticaret A.Ş.,,,,
TRENDYOLMİLLA Limited Edition Kahverengi Taş Baskılı Örme Şık Abiye Elbise TPRAW25EL00015,Örme,Polyester Karışımlı,Fitted,Uzun,Fashion Forward,Standart Kol,Düz,Dik Yaka,Kahverengi,Taş Baskı,Cepsiz,,Astarsız,Midi,Kruvaze,Kokteyl,Sandy,Trock / Taş Baskı,Kemersiz,Hayır,Tekli,Tüm Yaş Grupları,Kış,TR,DSM Grup Danışmanlık İletişim ve Satış Ticaret A.Ş.,,,,
TRENDYOLMİLLA Siyah Düz Maxi Dik Yaka Piliseli Skater/Belden Açılan Örme Elbise TWOSS25EL00513,Örme,,Regular,Kolsuz,Cool & Comfort,Standart Kol,Düz,Dik Yaka,Siyah,,,Ramadan,Astarsız,Maxi,Skater,Casual/Günlük,Sandy,,,,,,,TR,DSM Grup Danışmanlık İletişim ve Satış Ticaret A.Ş.,,,,
TRENDYOLMİLLA Mavi Midi Triko Elbise TWOSS25EL00307,Triko,,Slim,Kısa,Feminine,Standart Kol,Düz,V Yaka,Mavi,,,,Astarsız,Midi,Bodycone,Casual/Günlük,Tek Plaka,,,,,,,TR,DSM Grup Danışmanlık İletişim ve Satış Ticaret A.Ş.,,,İnce,
TRENDYOLMİLLA Bej Tüvit Dokuma Kısa Elbise TPRAW25EL00076,Dokuma,Polyester Karışımlı,Fitted,Kolsuz,Smart,Standart Kol,Düz,Kare Yaka,Bej,Taş Aksesuar,Cepsiz,,Astarsız,Mini,Skater,Şık/Gece,Tüvit,Baskısız,Kemersiz,Hayır,Tekli,Tüm Yaş Grupları,Kış,TR,DSM Grup Danışmanlık İletişim ve Satış Ticaret A.Ş.,Düz Kesim,,,
TRENDYOLMİLLA Siyah A Kesim Düğme Detaylı Mini Dokuma Elbise TWOAW25EL00132,Dokuma,Polyester Karışımlı,Regular,Uzun,Feminine,Standart Kol,Renk Bloklu,Dik Yaka,Siyah,Düğmeli,Cepsiz,,Astarsız,Mini,A-line,Gündüz / Gece,Finike,Baskısız,Kemersiz,Hayır,Tekli,Tüm Yaş Grupları,Kış,TR,DSM Grup Danışmanlık İletişim ve Satış Ticaret A.Ş.,A Kesim,Düğmeli,,
TRENDYOLMİLLA Antrasit Vücuda Oturan Tek Kol Simli Örme Midi Elbise TPRAW25EL00167,Örme,Poliamid Karışımlı,Fitted,Uzun,Fashion Forward,Tek Kol,Düz,Asimetrik Yaka,Gri,,,,Astarsız,Maxi,Bodycone,Kokteyl,Simli Örme,,Kemersiz,Hayır,,Tüm Yaş Grupları,Kış,TR,DSM Grup Danışmanlık İletişim ve Satış Ticaret A.Ş.,,,,
TRENDYOLMİLLA Ekru Dokuma Püsküllü Cut Out/Pencere Maxi Plaj Elbisesi TBESS21EL3624,Dokuma,,Regular,Askılı,Fashion Forward,Standart Kol,Düz,V Yaka,Ekru,,,,Astarsız,Maxi,A-line,Beachwear,Crinkle,,,,,,Yaz,TR,DSM Grup Danışmanlık İletişim ve Satış Ticaret A.Ş.,,,,
TRENDYOLMİLLA Kırmızı Vücuda Oturan Korse Detaylı Dokuma Şık Abiye Elbise TPRSS22EL00097,Dokuma,Polyester Karışımlı,Fitted,Kolsuz,Feminine,Düşük Kol,Çiçekli,Carmen Yaka,Kırmızı,,,Ramadan,Astarlı,Midi,Bodycone,Şık/Gece,Finike,,Kemersiz,Hayır,,Tüm Yaş Grupları,Yaz,TR,DSM Grup Danışmanlık İletişim ve Satış Ticaret A.Ş.,,,,
TRENDYOLMİLLA Siyah Sırt Detaylı Askılı Bürümcük/Dokulu Maxi Örme Elbise TWOSS24EL00259,Örme,Polyester Karışımlı,Regular,Askılı,Cool & Comfort,Standart Kol,Düz,Havuz Yaka,Siyah,Sırt Dekolteli,Cepsiz,Ramadan,Astarsız,Maxi,Eteği Fırfırlı,Casual/Günlük,Bürümcük,,Kemersiz,Hayır,,Tüm Yaş Grupları,Yaz,TR,DSM Grup Danışmanlık İletişim ve Satış Ticaret A.Ş.,,,,
TRENDYOLMİLLA Ekru Vücudu Saran Yırtmaçlı Askılı Astarlı Midi Kalem Etek Dokuma Elbise TWOSS19BB0216,Dokuma,Polyester Karışımlı,Regular,Askılı,Smart,Standart Kol,Düz,Kare Yaka,Ekru,Yırtmaçlı,Cepsiz,,Astarsız,Midi,Bodycone,Gündüz / Gece,Finike,,Kemersiz,Hayır,Tekli,Tüm Yaş Grupları,,TR,DSM Grup Danışmanlık İletişim ve Satış Ticaret A.Ş.,Yırtmaçlı,,,
Trendyol Curve Indigo Fitilli Midi Boy 2'li Hırka&Elbise Triko Takım TBBAW25AH00110,Triko,Triko,Fitted,Uzun,Cool & Comfort,Standart Kol,Düz,Bisiklet Yaka,Mavi,,Cepsiz,,Astarsız,Midi,Bodycone,Casual/Günlük,Fitilli,,Kemersiz,Hayır,2'li,Tüm Yaş Grupları,Kış,TR,DSM Grup Danışmanlık İletişim ve Satış Ticaret A.Ş.,,,,
Trendyol Curve Kırmızı Karpuz Kollu Maxi Dokuma Büyük Beden Elbise TBBSS25AH00148,Dokuma,,Relaxed,Kısa,Fashion Forward,Balon Kol,Düz,Kare Yaka,Kırmızı,,,Büyük Beden,,Maxi,A-line,Şık/Gece,Finike,,,,,Tüm Yaş Grupları,Yaz,TR,DSM Grup Danışmanlık İletişim ve Satış Ticaret A.Ş.,,,,
TRENDYOLMİLLA Çok Renkli Kuşaklı Animal Desenli Skater/Belden Açılan Mini Viskon Dokuma Elbise TWOAW25EL00461,Dokuma,,Regular,Uzun,Cool & Comfort,Balon Kol,Animal,Gömlek Yaka,Çok Renkli,,Cepsiz,,Astarsız,Mini,Skater,Casual/Günlük,Shally,,Kuşaklı,Hayır,,Tüm Yaş Grupları,İlkbahar / Sonbahar,TR,DSM Grup Danışmanlık İletişim ve Satış Ticaret A.Ş.,Eteği Belden Açılan,Kuşaklı,,
Trendyol Curve Siyah Fitilli Eteği Pile Detaylı Mini Triko Elbise TBBAW25AH00113,Triko,Polyester,Fitted,Uzun,Cool & Comfort,Standart Kol,Düz,Bisiklet Yaka,Siyah,,,,,Mini,Bodycone,Casual/Günlük,Fitilli,,Kemersiz,Hayır,,Tüm Yaş Grupları,,TR,DSM Grup Danışmanlık İletişim ve Satış Ticaret A.Ş.,,,,
TRENDYOLMİLLA Kahverengi Maxi  Volanlı Kare Yaka Vücuda Oturan Esnek  Örme Elbise TWOAW24EL00613,Örme,Polyester Karışımlı,Slim,Uzun,Smart,Standart Kol,Düz,Kare Yaka,Kahverengi,,Cepsiz,Ramadan,Astarsız,Maxi,Bodycone,Gündüz / Gece,Kalın Sandy,Baskısız,Kemersiz,Hayır,Tekli,Tüm Yaş Grupları,,TR,DSM Grup Danışmanlık İletişim ve Satış Ticaret A.Ş.,,,,
TRENDYOLMİLLA Limited Edition Antrasit Taş Baskılı Şık Midi Abiye Elbise TPRAW25EL00014,Dokuma,Viskoz Karışımlı,Fitted,Kolsuz,Fashion Forward,Standart Kol,Düz,Straplez,Gri,Taş Baskı,Cepsiz,,Astarsız,Midi,Bodycone,Kokteyl,Poliviskon,Trock / Taş Baskı,Kemersiz,Hayır,,Tüm Yaş Grupları,Kış,TR,DSM Grup Danışmanlık İletişim ve Satış Ticaret A.Ş.,,,,
TRENDYOLMİLLA Siyah Kemerli Belden Açılan Gömlek Detaylı Mini Dokuma Elbise TWOAW25EL00398,Dokuma,Polyester Karışımlı,Regular,Uzun,Feminine,Standart Kol,Renk Bloklu,Gömlek Yaka,Siyah,,Cepsiz,,Astarsız,Mini,Skater,Casual/Günlük,Finike,Baskısız,Kemerli,Hayır,Tekli,Tüm Yaş Grupları,Kış,TR,DSM Grup Danışmanlık İletişim ve Satış Ticaret A.Ş.,Eteği Belden Açılan,Kemer Tokası,,
TRENDYOLMİLLA Siyah Kısa Kol Fitted/Vücuda Oturan Pamuklu Esnek Midi Örme Kalem Elbise TWOSS23EL00313,Örme,Pamuklu,Slim,Kısa,Cool & Comfort,Standart Kol,Düz,Bisiklet Yaka,Siyah,,Cepsiz,Ramadan,Astarsız,Midi,Bodycone,Casual/Günlük,Likralı Süprem,,Kemersiz,Hayır,,Tüm Yaş Grupları,Yaz,TR,DSM Grup Danışmanlık İletişim ve Satış Ticaret A.Ş.,,,,
TRENDYOLMİLLA Siyah A Kesim Cep Detaylı Mini Dokuma Elbise TWOAW25EL00169,Dokuma,%100 Pamuk,Regular,Kısa,Smart,Standart Kol,Düz,Bisiklet Yaka,Siyah,,,,Astarsız,Mini,A-line,Gündüz / Gece,Tüvit,Baskısız,Kemersiz,Hayır,Tekli,Tüm Yaş Grupları,İlkbahar / Sonbahar,TR,DSM Grup Danışmanlık İletişim ve Satış Ticaret A.Ş.,,,,
TRENDYOLMİLLA Siyah Straplez Şifon Dokuma Şık Midi Yılbaşı Abiye Elbise TPRAW25EL00030,Dokuma,Şifon,Fitted,Kolsuz,Fashion Forward,Standart Kol,Düz,Straplez,Siyah,,Cepsiz,,Astarlı,Maxi,Shift,Kokteyl,Şifon,,Kemersiz,Hayır,,Tüm Yaş Grupları,Kış,TR,DSM Grup Danışmanlık İletişim ve Satış Ticaret A.Ş.,,,,
TRENDYOLMİLLA Taş Kuşaklı A Kesim Mini Kruvaze Yaka Dokuma Keten Görünümlü Elbise TWOSS19XN0008,Dokuma,Pamuklu,Regular,Askılı,Cool & Comfort,Standart Kol,Düz,Kruvaze,Gri,Kuşaklı,,,Astarlı,Mini,Skater,Casual/Günlük,Keten görünümlü,,Kuşaklı,Hayır,,Tüm Yaş Grupları,Yaz,TR,DSM Grup Danışmanlık İletişim ve Satış Ticaret A.Ş.,Eteği Belden Açılan,,,
TRENDYOLMİLLA Saks Cepli Premium Bisiklet Yaka A-Line Örme Midi Elbise TWOSS24EL00169,Örme,%100 Pamuk,Relaxed,Kısa,Cool & Comfort,Düşük Kol,Düz,Bisiklet Yaka,Lacivert,Cep Detaylı,,Ramadan,Astarsız,Midi,T-shirt Elbise,Casual/Günlük,20/1 penye süprem,,Kemersiz,Hayır,,Tüm Yaş Grupları,Yaz,TR,DSM Grup Danışmanlık İletişim ve Satış Ticaret A.Ş.,,,,
TRENDYOLMİLLA Mavi Mini Askılı Volanlı Denim Elbise TWOSS25EL00152,Denim,,Relaxed,Askılı,Cool & Comfort,Standart Kol,Düz,Kare Yaka,Mavi,,,,Astarsız,Kısa,Eteği Fırfırlı,Casual/Günlük,Rigid,,,,,,Yaz,TR,DSM Grup Danışmanlık İletişim ve Satış Ticaret A.Ş.,,,,
TRENDYOLMİLLA Siyah Kemerli Puantiyeli Şifon Astarlı Midi Dokuma Elbise TWOSS24EL00839,Dokuma,Polyester,Regular,Uzun,Feminine,Balon Kol,Puantiyeli,Kruvaze,Siyah,Kemerli,Cepsiz,,Astarlı,Maxi,Skater,Gündüz / Gece,Şifon,,Kemerli,Hayır,,Tüm Yaş Grupları,İlkbahar / Sonbahar,TR,DSM Grup Danışmanlık İletişim ve Satış Ticaret A.Ş.,Eteği Belden Açılan,,,
TRENDYOLMİLLA Bej Ekose / Kareli Jile Mini Dokuma Elbise TWOAW25EL00484,Dokuma,%100 Pamuk,Regular,Kolsuz,Cool & Comfort,Standart Kol,Ekose / Kareli,V Yaka,Bej,,Cepsiz,,Astarsız,Mini,Jile,Casual/Günlük,Flanel,,Kemersiz,Hayır,,Tüm Yaş Grupları,İlkbahar / Sonbahar,TR,DSM Grup Danışmanlık İletişim ve Satış Ticaret A.Ş.,,,,
TRENDYOLMİLLA Siyah Düğmeli Hakim Yaka Dokuma Ceket Elbise TWOAW24EL00422,Dokuma,Polyester Karışımlı,Regular,Kolsuz,Smart,Standart Kol,Düz,Hakim Yaka,Siyah,Düğmeli,Cepsiz,,Astarsız,Midi,Ceket Elbise,Gündüz / Gece,Poliviskon,Baskısız,Kemersiz,Hayır,Tekli,Tüm Yaş Grupları,Tüm Sezonlar,TR,DSM Grup Danışmanlık İletişim ve Satış Ticaret A.Ş.,,Düğmeli,,
TRENDYOL MODEST Siyah Eteği Piliseli Scuba Örme Elbise TCTAW24EL00000,Örme,Polyester,Regular,Uzun,Cool & Comfort,Standart Kol,Düz,Bisiklet Yaka,Siyah,Fermuar,,Ramadan,Astarsız,Maxi,A-line,Casual/Günlük,Scuba Krep,,Kemersiz,Hayır,,Tüm Yaş Grupları,Kış,TR,DSM Grup Danışmanlık İletişim ve Satış Ticaret A.Ş.,,,Orta,
TRENDYOLMİLLA Siyah Asimetrik Yaka Örme Şık Abiye Elbise TPRSS24EL00046,Örme,Polyester Karışımlı,Fitted,Kısa,Feminine,Standart Kol,Düz,Asimetrik Yaka,Siyah,,Cepsiz,Ramadan,Astarsız,Midi,Shift,Şık/Gece,Sandy,Baskısız,Kemersiz,Hayır,Tekli,Tüm Yaş Grupları,Yaz,TR,DSM Grup Danışmanlık İletişim ve Satış Ticaret A.Ş.,,,,
TRENDYOLMİLLA Siyah Straplez Midi Dokuma Elbise TWOAW25EL00388,Dokuma,Polyester,Regular,Kolsuz,Feminine,Standart Kol,Düz,Straplez,Siyah,,,,Astarsız,Midi,A-line,Gündüz / Gece,Finike,,Kemersiz,Hayır,,Tüm Yaş Grupları,İlkbahar / Sonbahar,TR,DSM Grup Danışmanlık İletişim ve Satış Ticaret A.Ş.,A Kesim,,,
TRENDYOLMİLLA Siyah Astarlı Volanlı Dokuma Şık Abiye Elbise TPRAW19BB0144,Dokuma,Polyester,Fitted,Kolsuz,Feminine,Standart Kol,Düz,Halter Yaka,Siyah,Volanlı / Fırfırlı,Cepsiz,Ramadan,Astarlı,Midi,Anvelop,Şık/Gece,Finike,Baskısız,Kemersiz,Hayır,Tekli,Tüm Yaş Grupları,Kış,TR,DSM Grup Danışmanlık İletişim ve Satış Ticaret A.Ş.,Vücudu Saran,,,
TRENDYOLMİLLA Siyah Vücuda Oturan Dokuma Şık Kısa Elbise TPRSS25EL00154,Dokuma,,Fitted,Kolsuz,Fashion Forward,Standart Kol,Düz,Kare Yaka,Siyah,,,,Astarsız,Mini,Bodycone,Şık/Gece,Finike,,,,,,,TR,DSM Grup Danışmanlık İletişim ve Satış Ticaret A.Ş.,Vücudu Saran,,,
TRENDYOLMİLLA Mor Fitilli Kare Yaka Vücuda Oturan Uzun Kol Yırtmaçlı Midi Elbise TWOAW22EL0871,Örme,Polyester Karışımlı,Slim,Uzun,Cool & Comfort,Standart Kol,Düz,Kare Yaka,Mor,Yırtmaçlı,Cepsiz,Ramadan,Astarsız,Midi,Bodycone,Casual/Günlük,Poliviskon Kaşkorse,Baskısız,Kemersiz,Hayır,Tekli,Tüm Yaş Grupları,Kış,TR,DSM Grup Danışmanlık İletişim ve Satış Ticaret A.Ş.,,,Orta,
TRENDYOLMİLLA Siyah Mini Dokuma Bağlamalı Flamlı Pamuk Plaj Elbisesi TBESS25EL00085,Dokuma,,Fitted,Kısa,Feminine,Standart Kol,Düz,V Yaka,Siyah,Bağlama Detaylı,,,Astarsız,Mini,Bodycone,Beachwear,Flamlı Pamuk,,,,,,,TR,DSM Grup Danışmanlık İletişim ve Satış Ticaret A.Ş.,,,,
TRENDYOLMİLLA Siyah Düz Maxi Maxi Triko Premium Kalite Triko Elbise TWOAW25EL00052,Triko,Triko,Regular,Uzun,Cool & Comfort,Standart Kol,Düz,Kayık Yaka,Siyah,,Cepsiz,,Astarsız,Maxi,Shift,Casual/Günlük,Tek Plaka,Baskısız,Kemersiz,Hayır,Tekli,Tüm Yaş Grupları,,TR,DSM Grup Danışmanlık İletişim ve Satış Ticaret A.Ş.,,,İnce,
TRENDYOLMİLLA Yağ Yeşili Askılı Degaje Yaka Vücüda Oturan Esnek Maxi Örme Elbise TWOSS25EL00368,Örme,,Slim,Askılı,Smart,Ay Kol,Düz,Degaje Yaka,Yeşil,Büzgü / Drape,,,Astarsız,Midi,Bodycone,Gündüz / Gece,Kalın Sandy,,,,,,,TR,DSM Grup Danışmanlık İletişim ve Satış Ticaret A.Ş.,,,,
TRENDYOLMİLLA Sarı Düz Düz Kesim Mini Dokuma Elbise TWOSS19FG0063,Dokuma,Polyester,Regular,Kolsuz,Office,Standart Kol,Düz,Bisiklet Yaka,Sarı,,Cepsiz,,Astarsız,Mini,Shift,Business,Finike,,Kemersiz,Hayır,,Tüm Yaş Grupları,Yaz,TR,DSM Grup Danışmanlık İletişim ve Satış Ticaret A.Ş.,Düz Kesim,,,
Trendyol Curve Siyah Kare Yaka Sırtı Bağlama Detaylı Dokuma Büyük Beden Elbise TBBSS25AH00080,Dokuma,,Relaxed,Kısa,Cool & Comfort,Standart Kol,Düz,Kare Yaka,Siyah,,,Büyük Beden,,Midi,A-line,Casual/Günlük,Poplin,,,,,Tüm Yaş Grupları,,TR,DSM Grup Danışmanlık İletişim ve Satış Ticaret A.Ş.,,,,
TRENDYOLMİLLA Çok Renkli Yırtmaçlı Desenli Dokuma Elbise TWOAW23EL00325,Dokuma,Dokuma,Regular,Uzun,Cool & Comfort,Balon Kol,Çiçekli,Bisiklet Yaka,Çok Renkli,Yırtmaçlı,Cepsiz,,Astarsız,Midi,A-line,Casual/Günlük,Belmando,Baskısız,Kemersiz,Hayır,Tekli,Tüm Yaş Grupları,İlkbahar / Sonbahar,TR,DSM Grup Danışmanlık İletişim ve Satış Ticaret A.Ş.,,,,
Trendyol Curve Camel Maxi/Uzun Boy Yırtmaçlı Yazlık Leopar Desenli Dokuma Elbise TBBSS24AH00136,Dokuma,,Fitted,Askılı,Cool & Comfort,Standart Kol,Animal,Kruvaze,Kahverengi,,Cepsiz,,Astarsız,Maxi,A-line,Casual/Günlük,Shally,,Kemersiz,Hayır,,Tüm Yaş Grupları,Yaz,TR,DSM Grup Danışmanlık İletişim ve Satış Ticaret A.Ş.,,,,
TRENDYOLMİLLA Kırmızı Puantiyeli Askılı Vücuda Oturan Fitilli Esnek Örme Maxi Kalem Elbise TWOSS24EL00682,Örme,,Slim,Askılı,Feminine,Standart Kol,Puantiyeli,V Yaka,Kırmızı,,,Ramadan,Astarsız,Maxi,Bodycone,Casual/Günlük,Polyester Kaşkorse,,,Hayır,,,Yaz,TR,DSM Grup Danışmanlık İletişim ve Satış Ticaret A.Ş.,,,,
TRENDYOLMİLLA Lacivert Tül Çiçekli Vücuda Oturan Kare Yaka Uzun Kol Maxi Esnek Örme Kalem Elbise TWOAW24EL00291,Örme,Polyester Karışımlı,Slim,Uzun,Fashion Forward,Standart Kol,Çiçekli,Kare Yaka,Lacivert,Bağlama Detaylı,Cepsiz,,Astarlı,Midi,Bodycone,Casual/Günlük,Tül,,Kemersiz,Hayır,,Tüm Yaş Grupları,İlkbahar / Sonbahar,TR,DSM Grup Danışmanlık İletişim ve Satış Ticaret A.Ş.,,,,
TRENDYOLMİLLA Lacivert Kuşaklı Çiçekli A Kesim Midi Astarlı Dokuma Kışlık Elbise TWOAW25EL00498,Dokuma,Polyester,Regular,Uzun,Feminine,Standart Kol,Çiçekli,Bisiklet Yaka,Lacivert,,Cepsiz,,Astarlı,Midi,A-line,Gündüz / Gece,Şifon,,Kuşaklı,Hayır,,Tüm Yaş Grupları,Kış,TR,DSM Grup Danışmanlık İletişim ve Satış Ticaret A.Ş.,A Kesim,Kuşaklı,,
TRENDYOLMİLLA Siyah A-Kesim Astarlı Dokuma Şifon Şık Mini Abiye Elbise TPRSS23EL00131,Dokuma,Polyester,Regular,Uzun,Feminine,Düşük Kol,Baskılı,Halter Yaka,Siyah,Gül Detaylı,Cepsiz,,Astarlı,Mini,Skater,Kokteyl,Şifon,Baskısız,Kemersiz,Hayır,Tekli,Tüm Yaş Grupları,Yaz,TR,DSM Grup Danışmanlık İletişim ve Satış Ticaret A.Ş.,Ek Özellik Mevcut Değil,,,
TRENDYOLMİLLA Limited Edition Çok Renkli Baskılı Sırt Detaylı Bodycon Maxi Esnek Örme Elbise TWOSS25EL00484,Örme,,Slim,Kolsuz,Fashion Forward,Standart Kol,Düz,Halter Yaka,Çok Renkli,,,Ramadan,Astarsız,Maxi,Bodycone,Casual/Günlük,Kalın Sandy,,,,,,,TR,DSM Grup Danışmanlık İletişim ve Satış Ticaret A.Ş.,,,,
TRENDYOLMİLLA Taş Midi Triko Kemer Detaylı Elbise TWOAW22EL0009,Triko,,Slim,Uzun,Feminine,Standart Kol,Düz,Bisiklet Yaka,Gri,,,,Astarsız,Midi,A-line,Casual/Günlük,Fitilli,,Kuşaklı,,,,,TR,DSM Grup Danışmanlık İletişim ve Satış Ticaret A.Ş.,,Kuşaklı,İnce,
TRENDYOLMİLLA Mürdüm Şal Desen Skater Fırfır Midi Dokuma Kışlık Elbise TWOAW21EL1448,Dokuma,Dokuma,Regular,Uzun,Feminine,Balon Kol,Şal Desen,V Yaka,Mor,Gipeli,Cepsiz,,Astarlı,Midi,Skater,Gündüz / Gece,Şifon,Baskısız,Kemersiz,Hayır,Tekli,Tüm Yaş Grupları,Kış,TR,DSM Grup Danışmanlık İletişim ve Satış Ticaret A.Ş.,Eteği Belden Açılan,,,
TRENDYOLMİLLA Siyah Baskılı Tül Büzgü/Drape Detaylı Vücuda Oturan V Yaka Mini Örme Kalem Elbise TWOAW24EL00548,Örme,Polyester Karışımlı,Slim,Uzun,Feminine,Standart Kol,Soyut,Kruvaze,Siyah,Büzgülü,Cepsiz,,Astarlı,Midi,Bodycone,Casual/Günlük,Tül,,Kemersiz,Hayır,Tekli,Tüm Yaş Grupları,Tüm Sezonlar,TR,DSM Grup Danışmanlık İletişim ve Satış Ticaret A.Ş.,Ek Özellik Mevcut Değil,,,
TRENDYOLMİLLA Siyah A Kesim Beli Ayarlanabilir Mini Dokuma Elbise TWOAW25EL00330,Dokuma,Polyester Karışımlı,Regular,Uzun,Cool & Comfort,Standart Kol,Düz,Dik Yaka,Siyah,,Cepsiz,,Astarsız,Mini,A-line,Casual/Günlük,Finike,,Kemersiz,Hayır,,Tüm Yaş Grupları,Kış,TR,DSM Grup Danışmanlık İletişim ve Satış Ticaret A.Ş.,A Kesim,,,
TRENDYOLMİLLA Beyaz Mini Dokuma Premium Deniz Kabuğu Aksesuarlı %100 Pamuklu Plaj Elbisesi TBESS24EL00020,Örme,%100 Pamuk,Relaxed,Uzun,Fashion Forward,Standart Kol,Düz,V Yaka,Beyaz,,Cepsiz,,Astarsız,Mini,Shift,Beachwear,Flamlı Pamuk,,Kemersiz,Hayır,,Tüm Yaş Grupları,Yaz,TR,DSM Grup Danışmanlık İletişim ve Satış Ticaret A.Ş.,,,,
Trendyol Curve Siyah Halter Yaka Animal Desenli Midi Dokuma Hamile & Büyük Beden Elbise TBBSS25AH00019,Dokuma,,Oversize,Kolsuz,Cool & Comfort,Standart Kol,Animal,Halter Yaka,Siyah,,,,,Midi,A-line,Casual/Günlük,Shally,,,,,,,TR,DSM Grup Danışmanlık İletişim ve Satış Ticaret A.Ş.,,,,
TRENDYOLMİLLA Lacivert  Detaylı Degaje Yaka Saten Dokuma Şık Elbise TPRSS25EL00003,Dokuma,,Fitted,Askılı,Fashion Forward,Standart Kol,Düz,Degaje Yaka,Lacivert,,,,Astarsız,Midi,Shift,Şık/Gece,Saten,,,,,,,TR,DSM Grup Danışmanlık İletişim ve Satış Ticaret A.Ş.,Düz Kesim,,,
TRENDYOLMİLLA Siyah Midi Triko Polo Yaka Elbise TWOAW24EL00029,Triko,Akrilik,Slim,Uzun,Cool & Comfort,Standart Kol,Düz,Polo Yaka,Siyah,,Cepsiz,,Astarsız,Midi,A-line,Casual/Günlük,Fitilli,,Kemersiz,Hayır,,Tüm Yaş Grupları,,TR,DSM Grup Danışmanlık İletişim ve Satış Ticaret A.Ş.,,,İnce,
TRENDYOLMİLLA Fuşya Düz Dokulu A Kesim/Çan Form Bisiklet Yaka Dokulu Maxi Elbise TWOSS24EL00683,Örme,,Regular,Kolsuz,Cool & Comfort,Standart Kol,Düz,Bisiklet Yaka,Pembe,Astarlı,,Ramadan,Astarlı,Maxi,A-line,Casual/Günlük,Dokulu,,,Hayır,,,Yaz,TR,DSM Grup Danışmanlık İletişim ve Satış Ticaret A.Ş.,,,,
Trendyol Curve Siyah Büyük Beden Astarsız Uzun Kollu A-Kesim Mini Dokuma Elbise TBBAW23AH00035,Dokuma,Polyester,Fitted,Uzun,Smart,Balon Kol,Düz,Dik Yaka,Siyah,,Cepsiz,Büyük Beden,Astarsız,Mini,A-line,Gündüz / Gece,Finike,,Yok,Hayır,Tekli,Tüm Yaş Grupları,İlkbahar / Sonbahar,TR,DSM Grup Danışmanlık İletişim ve Satış Ticaret A.Ş.,,,,
TRENDYOLMİLLA Mavi Çiçek Desenli Kuşaklı Midi Dokuma Viskon Gömlek Elbise TWOSS20EL1559,Dokuma,,Regular,Kısa,Cool & Comfort,Standart Kol,Animal,Gömlek Yaka,Mavi,Kuşaklı,,,Astarsız,Midi,Gömlek Elbise,Casual/Günlük,Shally,,Kuşaklı,Hayır,,Tüm Yaş Grupları,Yaz,TR,DSM Grup Danışmanlık İletişim ve Satış Ticaret A.Ş.,,Düğmeli,,
TRENDYOLMİLLA Bridal Ekru Dokuma Abiye Gece Elbise TPRSS21EL0053,Dokuma,Polyester,Fitted,Kısa,Feminine,Balon Kol,Düz,Kalp Yaka,Ekru,Büzgülü,Cepsiz,Ramadan,Astarsız,Midi,Bodycone,Şık/Gece,Finike,,Kemersiz,Hayır,,Tüm Yaş Grupları,Yaz,TR,DSM Grup Danışmanlık İletişim ve Satış Ticaret A.Ş.,,Fermuarlı,,
TRENDYOLMİLLA Soyut Desenli Vücuda Oturan Mini Örme Büzgülü Transparan Plaj Elbisesi TBESS22EL0702,Örme,Polyester,Slim,Uzun,Fashion Forward,Standart Kol,Animal,V Yaka,Kahverengi,Büzgülü,Cepsiz,,Astarsız,Mini,Bodycone,Beachwear,Şifon,,Kemersiz,Hayır,Tekli,Tüm Yaş Grupları,Yaz,TR,DSM Grup Danışmanlık İletişim ve Satış Ticaret A.Ş.,Ek Özellik Mevcut Değil,,,
TRENDYOLMİLLA Mor Askılı Fitted/Vücuda Oturan Kare Yaka Tül Midi Esnek Örme Kalem Elbise TWOSS22EL00726,Örme,Polyester,Slim,Askılı,Feminine,Standart Kol,Çiçekli,Kare Yaka,Mor,Astarlı,,,Astarlı,Midi,Bodycone,Gündüz / Gece,Tül,,Kemersiz,Hayır,,Tüm Yaş Grupları,Yaz,TR,DSM Grup Danışmanlık İletişim ve Satış Ticaret A.Ş.,,,,
TRENDYOLMİLLA Beyaz Dokuma Şerit Aksesuarlı Mini Plaj Elbisesi TBESS21EL2759,Dokuma,Polyester,Regular,Truvakar Kol,Feminine,Büzgülü/Fırfırlı Kol,Düz,V Yaka,Beyaz,Dantel,Cepsiz,,Astarsız,Mini,Basic,Beachwear,Crinkle,,Kemersiz,Hayır,Tekli,Tüm Yaş Grupları,Yaz,TR,DSM Grup Danışmanlık İletişim ve Satış Ticaret A.Ş.,,,,
TRENDYOLMİLLA Açık Antrasit Taş Detaylı Skater/Belden Açılan Kısa Kollu Mini Örme Kalem Elbise TWOAW24EL00395,Örme,,Slim,Kısa,Smart,Standart Kol,Düz,Bisiklet Yaka,Gri,İncili,,,Astarsız,Kısa / Mini,Bodycone,Gündüz / Gece,İnterlok,,,,,,İlkbahar / Sonbahar,TR,DSM Grup Danışmanlık İletişim ve Satış Ticaret A.Ş.,,,,
Trendyol Curve Siyah Taş İşlemeli Kalp Yaka Kolsuz Midi Dokuma Büyük Beden Elbise TBBSS25AH00061,Dokuma,,Fitted,Kolsuz,Fashion Forward,Standart Kol,Düz,Kare Yaka,Siyah,,,,,Midi,Bodycone,Party,Finike,,,,,,,TR,DSM Grup Danışmanlık İletişim ve Satış Ticaret A.Ş.,,,,
TRENDYOLMİLLA Fuşya A Kesim Fiyonklu Mini Dokuma Elbise TWOSS25EL00267,Dokuma,,Regular,Askılı,Feminine,Standart Kol,Düz,Kare Yaka,Pembe,Fiyonklu,,,Astarsız,Mini,A-line,Gündüz / Gece,Finike,,,,,,Yaz,TR,DSM Grup Danışmanlık İletişim ve Satış Ticaret A.Ş.,A Kesim,,,
Trendyol Curve Beyaz Madonna Yaka Dokuma Büyük Beden Abiye/Bridal/Nikah/Nişan/Gece Elbisesi TBBSS24AH00117,Dokuma,Polyester,Fitted,Askılı,Feminine,Kalın Askılı,Düz,Carmen Yaka,Beyaz,,Cepsiz,Büyük Beden,Astarsız,Midi,Skater,Düğün/Nikah,Krep,,Kemersiz,Hayır,,Tüm Yaş Grupları,,TR,DSM Grup Danışmanlık İletişim ve Satış Ticaret A.Ş.,,,,
TRENDYOLMİLLA Kahverengi Kruvaze Mini Dokuma Elbise TWOSS23EL00113,Dokuma,Dokuma,Regular,Uzun,Office,Standart Kol,Düz,Ceket Yaka,Kahverengi,,Cepsiz,,Astarlı,Mini,Ceket Elbise,Business,Finike,,Kemersiz,Hayır,,Tüm Yaş Grupları,Kış,TR,DSM Grup Danışmanlık İletişim ve Satış Ticaret A.Ş.,,,,
Trendyol Curve Pembe %100 Pamuk Dokuma Mini Büyük Beden Gömlek Elbise TBBSS25AH00157,Dokuma,,Relaxed,Uzun,Cool & Comfort,Standart Kol,Çizgili,Gömlek Yaka,Pembe,,,Büyük Beden,,Mini,Gömlek Elbise,Casual/Günlük,Terrycotton,,,,,Tüm Yaş Grupları,Yaz,TR,DSM Grup Danışmanlık İletişim ve Satış Ticaret A.Ş.,,,,
TRENDYOLMİLLA Bridal Beyaz Volan Detaylı Dokuma Düğün/Nikah Şık Abiye Elbise TPRAW19BB0144,Dokuma,Polyester,Fitted,Kolsuz,Feminine,Standart Kol,Düz,Halter Yaka,Beyaz,Volanlı / Fırfırlı,Cepsiz,Ramadan,Astarlı,Midi,Anvelop,Şık/Gece,Finike,Baskısız,Kemersiz,Hayır,Tekli,Tüm Yaş Grupları,Kış,TR,DSM Grup Danışmanlık İletişim ve Satış Ticaret A.Ş.,Vücudu Saran,,,
