Ürün Adı,Kumaş Tipi,Materyal,Kalıp,Kol Boyu,Persona,Kol Tipi,Desen,Yaka Tipi,Renk,Ürün Detayı,Cep,Koleksiyon,Astar Durumu,Boy,Siluet,Ortam,Dokuma Tipi,Baskı/Nakış Tekniği,Kemer/Kuşak Durumu,Sürdürülebilirlik Detayı,Paket İçeriği,Yaş,Sezon,Menşei,Üretici Bilgisi,Ek Özellik,Kapama Şekli
TRENDYOLMİLLA Siyah Düz Dokulu Fitted/Vücuda Oturan Maxi Örme Elbise TWOAW25EL00097,Örme,Polyester Karışımlı,Slim,Uzun,Cool & Comfort,Standart Kol,Düz,Kayık Yaka,Siyah,Sırt Dekolteli,Cepsiz,Ramadan,Astarsız,Maxi,Bodycone,Casual/Günlük,Gofre,Baskısız,Kemersiz,Hayır,Tekli,Tüm Yaş Grupları,Kış,TR,DSM Grup Danışmanlık İletişim ve Satış Ticaret A.Ş.,,
TRENDYOLMİLLA Siyah Kısa Kol Bodycone/Vücuda Oturan Bisiklet Yaka Esnek Örme Maxi Kalem Elbise TWOSS24EL00097,Örme,,Slim,Kısa,Fashion Forward,Standart Kol,Düz,Bisiklet Yaka,Siyah,,,Ramadan,Astarsız,Maxi,Bodycone,Casual/Günlük,Kalın Sandy,,,,,,,TR,DSM Grup Danışmanlık İletişim ve Satış Ticaret A.Ş.,,
TRENDYOLMİLLA Mavi Cep Detaylı Mini Denim Gömlek Elbise TWOAW23EL00643,Denim,Denim,Slim,Uzun,Fashion Forward,Standart Kol,Düz,Gömlek Yaka,Mavi,,Cepsiz,,Astarsız,Kısa,Bodycone,Şık/Gece,Rigid,,Kemersiz,Hayır,,Tüm Yaş Grupları,Tüm Sezonlar,TR,DSM Grup Danışmanlık İletişim ve Satış Ticaret A.Ş.,Ek Özellik Mevcut Değil,
TRENDYOLMİLLA Geometrik Desenli Maxi Dokuma Püsküllü Plaj Elbisesi TBESS24EL00166,Dokuma,Dokuma,Regular,Kısa,Cool & Comfort,Standart Kol,Geometrik,Hakim Yaka,Çok Renkli,,Cepsiz,,Astarsız,Midi,Skater,Beachwear,Mesh,,Kemersiz,Hayır,,Tüm Yaş Grupları,Yaz,TR,,,
TRENDYOLMİLLA Siyah Fitted/Vücuda Oturan Askılı Maxi Esnek Örme Kalem Elbise TWOSS23EL02435,Örme,Elastan,Slim,Askılı,Fashion Forward,Standart Kol,Düz,Kare Yaka,Siyah,,Cepsiz,Ramadan,Astarsız,Maxi,Bodycone,Casual/Günlük,Kalın Sandy,Baskısız,Kemersiz,Hayır,Tekli,Tüm Yaş Grupları,,TR,DSM Grup Danışmanlık İletişim ve Satış Ticaret A.Ş.,,
TRENDYOLMİLLA Siyah Düğme Detaylı Mini Dokuma Ceket Elbise TWOAW24EL00462,Dokuma,Polyester Karışımlı,Regular,Uzun,Office,Standart Kol,Düz,Ceket Yaka,Siyah,Düğmeli,Cepsiz,,Astarsız,Mini,Ceket Elbise,Business,Finike,Baskısız,Kemersiz,Hayır,Tekli,Tüm Yaş Grupları,Kış,TR,DSM Grup Danışmanlık İletişim ve Satış Ticaret A.Ş.,,Düğmeli
TRENDYOLMİLLA Siyah Taş Detaylı Skater/Belden Açılan Kısa Kollu Mini Örme Kalem Elbise TWOAW24EL00395,Örme,,Slim,Kısa,Smart,Standart Kol,Düz,Bisiklet Yaka,Siyah,İncili,,,Astarsız,Mini,Bodycone,Gündüz / Gece,İnterlok,,,,,,İlkbahar / Sonbahar,TR,DSM Grup Danışmanlık İletişim ve Satış Ticaret A.Ş.,,
TRENDYOLMİLLA Siyah A Kesim Mini Dokuma Elbise TWOAW25EL00192,Dokuma,Polyester Karışımlı,Regular,Kolsuz,Smart,Standart Kol,Düz,Bisiklet Yaka,Siyah,,Cepsiz,,Astarlı,Mini,A-line,Business,Finike,Baskısız,Kemersiz,Hayır,Tekli,Tüm Yaş Grupları,Tüm Sezonlar,TR,DSM Grup Danışmanlık İletişim ve Satış Ticaret A.Ş.,A Kesim,
TRENDYOLMİLLA Pembe A-Kesim Dokuma Poplin Kısa Şık Abiye Elbise TPRSS24EL00038,Dokuma,Dokuma,Relaxed,Kısa,Feminine,Standart Kol,Düz,Carmen Yaka,Pembe,,Cepsiz,,Astarsız,Mini,Skater,Kokteyl,Poplin,,Kemersiz,Hayır,,Tüm Yaş Grupları,,TR,,,
TRENDYOLMİLLA Siyah Düz Midi Vatkalı Drapeli Bodycone/Vücuda Oturan Esnek Elbise Örme Elbise TWOSS24EL00975,Örme,,Regular,Kolsuz,Smart,Ay Kol,Düz,Kayık Yaka,Siyah,,,Ramadan,Astarsız,Midi,Bodycone,Casual/Günlük,Kalın Sandy,,,Hayır,,,Yaz,TR,DSM Grup Danışmanlık İletişim ve Satış Ticaret A.Ş.,,
